#,Patient Care,Price,Rating,Link,Top Review
1,"ReliOn Nitrile Examination Gloves, 100 Ct",$9.24,4.4/5.0,https://www.walmart.com/ip/ReliOn-Nitrile-Examination-Gloves-100-Ct/14284765,blank
2,Curad Basic Care Large/Extra Large Vinyl Exam Gloves  ...,$7.73,4.3/5.0,https://www.walmart.com/ip/Curad-Basic-Care-Large-Extra-Large-Vinyl-Exam-Gloves-100-count/44621723,blank
3,"Oxygen Supply Tubing ''25 ft. x 3/16 I.D., Clear, 1   ...",$6.04,5.0/5.0,https://www.walmart.com/ip/Oxygen-Supply-Tubing-25-ft-x-3-16-I-D-Clear-1-Count/195071336?wpa_bd=&wpa_pg_seller_id=DABA61A51AA444798605B2E5391AF8EA&wpa_ref_id=c0c0c49178de4f34954bec67fdff1db7&wpa_aux_info=__aux_info__&wpa_tag=&wpa_pos=3&wpa_plmt=__plmt__&wpa_aduid=__aduid__,blank
4,"Equate Latex Examination Gloves, One Size, 50 Ct",$5.96,0.0/5.0,https://www.walmart.com/ip/Equate-Latex-Examination-Gloves-One-Size-50-Ct/300343224,blank
5,"Cervical Traction Kit ''Overdoor, One Size Fits Most  ...",$15.60,5.0/5.0,https://www.walmart.com/ip/Cervical-Traction-Kit-Overdoor-One-Size-Fits-Most/159989271?wpa_bd=&wpa_pg_seller_id=DABA61A51AA444798605B2E5391AF8EA&wpa_ref_id=c8fb41fa1d75acd5ec8fa0f2ef92eddf&wpa_aux_info=__aux_info__&wpa_tag=&wpa_pos=5&wpa_plmt=__plmt__&wpa_aduid=__aduid__,blank
6,Safeskin Purple Nitrile Powder-Free Exam Disposable   ...,$13.19 - $14.22,4.3/5.0,https://www.walmart.com/ip/Safeskin-Purple-Nitrile-Powder-Free-Exam-Disposable-Gloves-Large/10715978,blank
7,"3M Littmann Classic III Stethoscope, Available in Mu  ...",$80.00 - $92.99,3.7/5.0,https://www.walmart.com/ip/3M-Littmann-Classic-III-Stethoscope-Available-in-Multiple-Colors/170590406,blank
8,"3M Littmann Lightweight II S.E. Stethoscope, Black T  ...",$45.00 - $54.44,3.2/5.0,https://www.walmart.com/ip/3M-Littmann-Lightweight-II-S-E-Stethoscope-Black-Tube-28-inch/21720622,blank
9,"3M Littmann Cardiology IV Stethoscope, Available in   ...",$164.65 - $186.19,2.7/5.0,https://www.walmart.com/ip/3M-Littmann-Cardiology-IV-Stethoscope-Available-in-Multiple-Colors/112383005,blank
10,"(3 Pack) Curad Nitrile Powder-Free Exam Gloves, 100   ...",$19.96 - $39.75,4.4/5.0,https://www.walmart.com/ip/3-Pack-Curad-Nitrile-Powder-Free-Exam-Gloves-100-ct/813611434,blank
11,Navage Nasal Irrigation Deluxe Bundle: Navage Nose C  ...,$116.95 - $119.95,4.0/5.0,https://www.walmart.com/ip/Navage-Nasal-Irrigation-Deluxe-Bundle-Navage-Nose-Cleaner-48-SaltPod-Capsules-Countertop-Caddy-Travel-Case-162-75-purchased-separately-You-save-52-80/157182505,blank
12,"Equate Vinyl Examination Gloves, 100 Ct",$7.98,0.0/5.0,https://www.walmart.com/ip/Equate-Vinyl-Examination-Gloves-100-Ct/709075118,blank
13,Nature Made® Super B-Complex Dietary Supplement Tabl  ...,$15.444.0¢/each,5.0/5.0,https://www.walmart.com/ip/Nature-Made-Super-B-Complex-Dietary-Supplement-Tablets-390ct/634283052,blank
14,Kimberly-Clark PROFESSIONAL Protective Gear Disposab  ...,$11.69 - $18.04,4.5/5.0,https://www.walmart.com/ip/Kimberly-Clark-PROFESSIONAL-Protective-Gear-Disposable-Purple-Nitrile-Exam-Gloves-Small-100-Count-KCC-55081/22582311,blank
15,CURAD Powder-Free Textured Latex Exam Gloves - CUR81  ...,$11.50 - $15.15,4.8/5.0,https://www.walmart.com/ip/CURAD-Powder-Free-Textured-Latex-Exam-Gloves-CUR8104/22582340,blank
16,"3M Littmann Classic II S.E. Adult Stethoscope, Black",$64.28,4.5/5.0,https://www.walmart.com/ip/3M-Littmann-Classic-II-S-E-Adult-Stethoscope-Black/14930019,blank
17,ChoiceMMed Pulse Oximeter,$34.99,4.6/5.0,https://www.walmart.com/ip/ChoiceMMed-Pulse-Oximeter/17325061,blank
18,"Equate Earloop Mask Disposable Mask, 20 Ct",$2.97,5.0/5.0,https://www.walmart.com/ip/Equate-Earloop-Mask-Disposable-Mask-20-Ct/745929347,blank
19,"Cervical Neck Traction Device, Inflatable Neck Tract  ...",$17.95,5.0/5.0,https://www.walmart.com/ip/Cervical-Neck-Traction-Device-Inflatable-Neck-Traction-Neck-Brace-for-Fast-Neck-Head-Shoulder-Pain-Relief-Adjustable-and-FDA-Approved/136497820,blank
20,"Equate Gauze Pads, 3""x3"", 25 Ct",$3.54,5.0/5.0,https://www.walmart.com/ip/Equate-Gauze-Pads-3-x3-25-Ct/344776932,blank
21,"Equate Headache Relief, Acetaminophen, Aspirin & Caf  ...",$4.00,5.0/5.0,https://www.walmart.com/ip/Equate-Headache-Relief-Acetaminophen-Aspirin-Caffeine-Extra-Strength-Twin-Pack-200-Caplets/350249376,blank
22,Cara Hot Water Bottle Personal Hygiene And Enema Sys  ...,$14.46,4.2/5.0,https://www.walmart.com/ip/Cara-Hot-Water-Bottle-Personal-Hygiene-And-Enema-System-2-Quart-Combination/10320773,blank
23,"Equate Vinyl Examination Gloves, One Size, 50 Ct",$5.84,0.0/5.0,https://www.walmart.com/ip/Equate-Vinyl-Examination-Gloves-One-Size-50-Ct/265514745,blank
24,"(2 Pack) Curad Basic Care Vinyl Exam Gloves, Small/M  ...",$8.34,0.0/5.0,https://www.walmart.com/ip/2-Pack-Curad-Basic-Care-Vinyl-Exam-Gloves-Small-Medium-100-count/251537128,blank
25,Nauzene Nausea Relief Chewable Tablets Wild Cherry F  ...,$4.96,5.0/5.0,https://www.walmart.com/ip/Nauzene-Nausea-Relief-Chewable-Tablets-Wild-Cherry-Flavor-42-CT/932026162,blank
26,"Medline Powder-Free Synthetic Vinyl Exam Gloves, Med  ...",$53.004.0¢/each,4.5/5.0,https://www.walmart.com/ip/Medline-Powder-Free-Synthetic-Vinyl-Exam-Gloves-Medium-Case-of-1500/23955876,blank
27,ProSource Acupressure Mat and Pillow Set for Back/Ne  ...,$19.99,0.0/5.0,https://www.walmart.com/ip/ProSource-Acupressure-Mat-and-Pillow-Set-for-Back-Neck-Pain-Relief-and-Muscle-Relaxation/50997715,blank
28,"Curad Powder-Free Latex Gloves, 50 Ct",$4.54,4.4/5.0,https://www.walmart.com/ip/Curad-Powder-Free-Latex-Gloves-50-Ct/16608858,blank
29,"BD Ultra-Fine Pen Needles Nano, Penta Point Comfort,  ...",$25.95,5.0/5.0,https://www.walmart.com/ip/BD-Ultra-Fine-Pen-Needles-Nano-Penta-Point-Comfort-4mm-x-32G-90-Count/118727719,blank
30,"Curad Universal Surgical Facemasks, 10 Ct",$7.99,4.7/5.0,https://www.walmart.com/ip/Curad-Universal-Surgical-Facemasks-10-Ct/20704296,blank
31,CPAP H2O Premium Distilled Water - 10 Bottle Pack,$21.99,0.0/5.0,https://www.walmart.com/ip/CPAP-H2O-Premium-Distilled-Water-10-Bottle-Pack/676534792,blank
32,As Seen On Tv Lo Bak Trax Back Stretcher - Dual Trac  ...,$29.88,3.8/5.0,https://www.walmart.com/ip/As-Seen-On-Tv-Lo-Bak-Trax-Back-Stretcher-Dual-Traction-Force-Spinal-Traction-Device/983625450,blank
33,Frio Duo Insulin Cooling Case,$19.99,4.0/5.0,https://www.walmart.com/ip/Frio-Duo-Insulin-Cooling-Case/36442149,blank
34,Soft Stretchy Ear Loop Face Mouth Mask Muffle Solid   ...,$5.47,4.6/5.0,https://www.walmart.com/ip/Soft-Stretchy-Ear-Loop-Face-Mouth-Mask-Muffle-Solid-Black-7-x-5/45586727,blank
35,"SCRUBSTAR Women's Fashion Collection ""Polar Penguins  ...",$15.96,0.0/5.0,https://www.walmart.com/ip/SCRUBSTAR-Women-s-Fashion-Collection-Polar-Penguins-Printed-Scrub-Top/435139868,blank
36,Dual-Head Stethoscopes,$7.65 - $10.53,5.0/5.0,https://www.walmart.com/ip/Dual-Head-Stethoscopes/14867655,blank
37,"Herbal Perineal Spray - Naturally Soothing, Safe for  ...",$11.88$2.97/oz,5.0/5.0,https://www.walmart.com/ip/Herbal-Perineal-Spray-Naturally-Soothing-Safe-for-Pregnancy-and-Postpartum-4-Fl-Oz/26961041,blank
38,Medline Walker Basket Accessory,$19.25,4.0/5.0,https://www.walmart.com/ip/Medline-Walker-Basket-Accessory/7983662,blank
39,Primacare ST-6856 CPR Mask,$5.51,0.0/5.0,https://www.walmart.com/ip/Primacare-ST-6856-CPR-Mask/55381439,blank
40,Ambimed Easy and Comfortable Diabetic Injection Aid,$27.99,5.0/5.0,https://www.walmart.com/ip/Ambimed-Easy-and-Comfortable-Diabetic-Injection-Aid/590785169,blank
