"ACE Knee Brace with Dual Side Stabilizers, Adjustabl  ...",$14.94,4.2/5.0,https://www.walmart.com/ip/ACE-Knee-Brace-with-Dual-Side-Stabilizers-Adjustable-Black-Gray/19898440,"The ACE Brand Knee Brace with Dual Side stabilizers delivers reliable stability so you can stay active with the ones you care about. Whether you've got a nightly walking date with Fluffy or a weekly gym meet-up with your best friend, our knee brace hugs your knee with comfortable compression to stabilize your weak or sore muscles and joints. Adjustable features offer the perfect fit. You're a person of your wordso keep those dates with the help of the ACE Brand Knee Brace with Dual Side stabilizers.","This is my 3rd Knee Brace and is by far the best one I've had. I began having problems with my knee and bought something that was nothing more than an elastic bandage. It was junk. I then got one (not an Ace) that just wrapped around my leg above and below the knee. It provided support but had some problems. It would tend to slip down my leg. It had an opening between the top and bottom strap, so if I tightened it enough so it wouldn't slip, the flesh of my leg would bulge (swell) out the sides. The most annoying problem was that it would irritate the back of my knee and cause substantial itching, plus it seemed to make my leg sweat in that area. By the way it was made by a different manufacturer that begins with M.
This Ace has been MUCH MUCH better. You have to initially slide it up your leg (slight negative) because it has a smooth cloth that fits behind the knee and has not caused me any irritation there at all. It doesn't slip, I don't seem to sweat with it, and there is no irritation to the back of my knee. It has 3 straps that completely encapsulate the knee so I've had no bulging. It's a good product for me and I would definitely recommend it to others."
"ACE Brand Reversible Splint Wrist Brace, Adjustable,  ...",$10.30,4.5/5.0,https://www.walmart.com/ip/ACE-Brand-Reversible-Splint-Wrist-Brace-Adjustable-Gray-1-Pack/23598249,"When your wrist feels wonky, reach for the stabilizing support of the ACE Adjustable Reversible Splint Wrist Brace. This wrist brace allows you to wear it on either wrist for lasting use. Multiple straps help you achieve your desired amount of support, and the ergonomic design lets you retain full mobility in your fingers. Slip on the supportive comfort of the ACE Adjustable Reversible Splint Wrist Brace.","This is a durable brace that works well for carpal tunnel therapy. The design has improved over the years and is generally very comfortable. My only complaint is that the sizing was more snug than I expected. Now that they have made the thumb loop a continuous part of the body, rather than a velcro adjustable part, the unit was initially more snug than I prefer. However, I have stretched it slightly by placing it over a jar when I am wearing my other supports, especially at night. It is now even more comfortable and does an excellent job when I am working at my keyboard.
Size info: my palm is 9.5inches at the width and my wrist is 7.75inches around. If your sizing is more than 1/4th inch larger than mine, this is probably not the unit you want."
"ThermaCare Advanced Back Pain Therapy (2 Count, S-M   ...",$5.94$2.97/each,4.6/5.0,https://www.walmart.com/ip/ThermaCare-Advanced-Back-Pain-Therapy-2-Count-S-M-Size-Heatwraps-16-Hours-Pain-Relief-Lower-Back-Hip-Use-Temporary-Relief-Muscular-Joint-Pains/13269725?wpa_bd=&wpa_pg_seller_id=F55CDC31AB754BB68FE0B39041159D63&wpa_ref_id=5c6e7c9a56cac7b0430d5f46d5a6c9cb&wpa_aux_info=__aux_info__&wpa_tag=&wpa_pos=3&wpa_plmt=__plmt__&wpa_aduid=__aduid__,"16 Hour Pain Relief from Lower Back Pains &amp; Hip Pains Unlike other creams, rubs and patches, which create sensations on your skin to mask pain, ThermaCare Heatwraps use real heat therapy to accelerate healing and relieve pain at the source for up to 8 hours, and once removed, another 8 hoursthats 16 hours of relief from aches and pains. How To Use: 1. Ensure skin in application area is clean, dry and free of makeup, recently applied skin moisturizer, lotions and other topical analgesics. 2. Position wrap flat on your skin and ensure the darker heat cells are placed towards skin. 3. Use care when handling the wrap to prevent over-tightening.(1) (1) Read full product labeling for complete usage instructions.",I saw this product in the store and thought i would give it a try. So very glad i did! As a mom i do not have much down time to just sit with a heating pad to help relieve my back pain. When i tried this wrap i knew i could never be without it! The warming is so relaxing on my back and works amazing! This is a new staple in my household. Thank you Thermacare
Mueller Adjustable Ankle Stabilizer,$12.24,3.9/5.0,https://www.walmart.com/ip/Mueller-Adjustable-Ankle-Stabilizer/10533462,Fully adjustable design provides customer fit and firm compression ideal for sprained strained and arthritic ankles,"The Ankle Stabilizer is simple to put on and isn't bulky to where I would not be able to put on my basketball shoes.

This is the third one I have bought (I wear one on each ankle, the other was discarded as it had worn out and the velcro no longer stuck) and these last quite a while depending on usage.

Provides really good support and have not rolled my ankle since I have started using them.

Try not to wear too tight as it may cut off blood circulation causing your foot to go numb."
CW-X Men's Stabilyx Knee Support,$31.96,5.0/5.0,https://www.walmart.com/ip/CW-X-Men-s-Stabilyx-Knee-Support/346337509,"<p></p> <h2>FEATURES of the CW-X Men's Stabilyx Knee Support</h2> <ul>  <li>Patented CW-X Support Web based on Kinesiology taping</li>  <li>Bands together the muscles and ligaments of the knee to increase joint stability and reduce vibration for increased efficiency</li>  <li>Support system built right into a knee sleeve that you can easily put on and take off</li>  <li>Made from specialised gripper material that prevents slipping</li>  <li>EXO-Stretch FABRIC helps to keep your body cool and dry, pulls moisture away from the body</li> </ul> <p></p>","I bought two of these for a hike I have coming up.  They are comfortable to wear, and not too tight, and keep my knees toasty warm.  I like these better than the 7MM lifting type selves. [This review was collected as part of a promotion.]"
Mueller Lumbar Back Brace,$16.69,4.1/5.0,https://www.walmart.com/ip/Mueller-Lumbar-Back-Brace/10533468,"<p>Get ready to enjoy all of your normal daily activities with the Mueller Lumbar Back Brace. It helps relieve the pain from strains, sprains and muscle spasms. The double layer design in this adjustable lumbar back brace allows for a custom fit. It is made to give helpful compression to the abdomen and lower back. The Mueller brace works to provide relief from injuries and strenuous movements to keep you going. The breathable fabric is designed for comfortable all-day wear. It features a removable pad that cushions and holds well for concentrated support. The four flexible steel springs conform to your body. A tapered cut ensures a snug fit for men and women. It has outer elastic straps made for strong customized tension. The main elastic band widens in the rear for broad coverage.</p> <b>Mueller Lumbar Back Brace:</b>","I purchased one these in a Walmart store a couple of years ago and I love it. My back goes out a lot and when it does, I would not be able to walk without this back brace. My daughter pulled her back a few weeks ago so I gave her mine. I went to Walmart to purchase another one and learned they are only sold online now. So I order another one for myself. Please don't stop selling them. I have found no other store that offers them in-store or online. Not even big chain drug stores."
"Copper Fit Back Support, size 39""-50""",$19.88,3.7/5.0,https://www.walmart.com/ip/Copper-Fit-Back-Support-size-39-50/43723172,,"I bought this and it helped somewhat for my back but about 45 days later it started falling apart at the seam, it's poor quality and I would not recommend it."
"Mueller Sport Care Antimicrobial Thumb Stabilizer, M  ...",$10.00,4.5/5.0,https://www.walmart.com/ip/Mueller-Sport-Care-Antimicrobial-Thumb-Stabilizer-Maximum-Support-Level-One-Size/14237860,"<p>Mueller?? Thumb Stabilizer Maximum Support Level. Made with breathable and lightweight fabrics for extended wear. Has one size fits most and three adjustable straps for custom fit. Provides warmth to the thumb area and joint. Helps athletes stay in the game and perform at their peak. For use on soft tissue injuries, ligament strains, gamekeeper's thumb, osteoarthritis and degenerative joint disease. This reversible antimicrobial thumb stabilizer is FSA eligible and not made with natural rubber latex.</p>","A prescription brace has been ordered for me but will take a few months. My general doctor told me get an interim brace and try Walmart. I went online because I couldn't deal with the shoppers around Thanksgiving with my hand so bad PLUS there were more braces online. I found this one online. I would have liked to have seen it in the store but I believe I read it isn't in stores and only online, but I was desparate and ordered it. It arrived in the mail and it looks and feels good and should be enough to hold me until the brace arrives. GREAT PRICE."
"Copper Fit Back Support, size 28""-39""",$18.46,4.4/5.0,https://www.walmart.com/ip/Copper-Fit-Back-Support-size-28-39/51938211,"Copper Fit Back Support is a copper-infused compression garment designed to provide everyday support, comfort and relief for lower back and abdominal muscles. Featuring a slim, lightweight design, The Copper Fit Back Support allows for increased mobility and fits discreetly under your clothes. Made of a high quality polyester and spandex blend with a high-wicking composition, Copper Fit copper-infused Back Support is designed to help you move more comfortably through your day. The natural properties of copper help protect the garment from odor causing bacteria and stains while the wicking property pulls sweat away from the skin. Simply adjust the Velcro closure for a quick ; easy custom fit that delivers comfort, compression and support throughout your work out or work day. Copper Fit. Live Limitless. NOTE: compression garments are only effective when they are being worn and properly sized. SIZE: Small/Medium: fits waist sizes 28&amp; 8221;&amp; 8211; 39&amp; 8221; Large/X-Large: fits waist sizes 39&amp; 8221;&amp; 8211; 50&amp; 8221;","This is a good size for me.  The large-extra large version is way too big (i am 5'11, 173 lbs with a 34"" waist). I like the product a lot. I had one before but washing it in the washing machine wore out the velcro.  Lesson learned so this one should last longer than the one year the previous one lasted."
Adjustable Elastic Back Women Belt Support Posture C  ...,$8.79 - $8.93,5.0/5.0,https://www.walmart.com/ip/Adjustable-Elastic-Back-Women-Belt-Support-Posture-Corrector-Brace-Support/859069159,"<h3>Search term:</h3> <ul>  <li>Adjustable Elastic, Back Women Belt, Support Posture, Corrector Brace, </li>  <li>Shoulder Corrector, Health Care, </li> </ul> <br /> <h3>Features:</h3> <ul>  <li>Body sculpting underwear can be rebuilt, reshape the body curve. </li>  <li>Underwear sculpt the body, can immediately sculpture of his figure, revealed a good posture, underwear sculpt the body under the care of his body, </li>  <li>The right concentration of chest, waist, sculpture, and hip action, the creation of a skin naturally.</li>  <li>Slim and sexy beauty.</li>  <li>Elastic material, easy to fit your body.</li>  <li>Description:</li>  <li>The fabric is elastic, so it is suitbale for your size.</li>  <li>The material it super comfortable.</li>  <li>Modern clipper-built designation with elegant and attractive appearance.</li> </ul> <br /> <h3>Specification:</h3> <ul>  <li>Material: Nylon, Spandex</li>  <li>Color: Black, skin color</li>  <li>Size: M, L</li>  <li>Bust Size (Flat) Bust (Stretched)</li>  <li>M 70 cm / 27.3 ; 85 cm / 33.15;</li>  <li>L 75 cm / 29.25 ; 90 cm / 35.1;</li> </ul> <br /> <h3>Package Includes:</h3>1 * Body Shaper Corset <li>Notice:</li> <li>1. Due to the different of the monitor and the light effect, the actual color of the item may be slightly different from the color shown in the pictures. thank you!</li> <li>2. Please allow 1-3 cm measurement deviation due to manual measurement.</li> <li>3. Asia size is smaller than US / US / UK size, please check the detail size information before buying. thank you.</li>","Works. 
Use sizing chart."
"Copper Hands Compression Gloves, S/M",$12.88 - $19.97,3.4/5.0,https://www.walmart.com/ip/Copper-Hands-Compression-Gloves-S-M/39263700,"Make sure that you stay active when you have these Copper Hands Compression Gloves. They're stylish and designed with several infused embellishments. Copper Hands gloves provide soothing relief when you put them on. They give you comfort and support for wrists, fingers and hands while helping to eliminate pain. The ultra-light breathable fabric is suitable for year-round use. Plus, the open fingertips are helpful for using any touchscreen device like a smartphone or tablet. These arthritis gloves are handy for working on your favorite hobbies, completing common household tasks like opening jars and much more. They're available in your choice of assorted sizes.  <br />","Excellent therapeutic glove ! Working on a computer all day long, gives me quite a discomfort & aching joints.  I use these gloves and relieve is fast......!
I've given them as gift to relatives for with arthritis and carpal tunnel issues.... it helps them feel less pain!"
ACE Moderate-Stabilizing Support Adjustable Back Bra  ...,$14.37,4.5/5.0,https://www.walmart.com/ip/ACE-Moderate-Stabilizing-Support-Adjustable-Back-Brace-Black-Gray/23598250,Put in a hard day's work or a game well played with an ACE Back Brace. Odor resistant support. The adjustable Brace supports your lumbar and abdominal area.,"Easy to use and adjust and did support my back - as I hoped. Usually my back would ach over longer walking distances and this clearly helped. For the cost it's worth taking a chance if you experience pain while standing or walking for long periods of time.

Also hides well too as it is not bulky."
"ACE Brand Elastic Bandage w/ clips, 3 in",$2.89,4.8/5.0,https://www.walmart.com/ip/ACE-Brand-Elastic-Bandage-w-clips-3-in/19898439,"ACE Brand Elastic Bandages are designed to provide support and compression during recovery and return to activity. They are comfortable to wear for extended periods of time, easy to use, and adjustable for a custom fit.","My boys play college Rugby. It can be a rough sport. The boys love the exercise, challege, and team effort. Every season inevitably several of the guys on the team will suffer some kind of injury. At this point I will hop into action accessing the complaint and administering first aid. Every game I bring a first aid bag. One of the key essentials is ace bandages. Thank goodness for ace bandage. They are quick and easy to apply at any location and under
any adverse weather condition. Ace bandage is a wonderful product."
ACE Adjustable Hinged Knee Brace Allows Safe Motion   ...,$18.99,4.0/5.0,https://www.walmart.com/ip/ACE-Adjustable-Hinged-Knee-Brace-Allows-Safe-Motion-and-Strong-Lateral-Stabilization-and-Support-Black/47070932,,"No size indication on the box and it won't go around my leg all the way. I have average size legs for an adult male. Looking at the box and pictures on this website, the models are petite women. Unless you are very small framed, don't waste your time and money on this.  I measured the top of the brace, (largest part), and there is only 18"" of material.  So taking into account that the Velcro needs to overlap in order to hold, I would say that if your leg measured above your knee is 16"" or less, this would work for you. That is way too small for ""one size fits all"". Very disappointing."
"Copper Fit Compression Knee Sleeve, Large",$9.88,3.8/5.0,https://www.walmart.com/ip/Copper-Fit-Compression-Knee-Sleeve-Large/38573958,"Copper Fit Compression Knee Sleeves are copper-infused compression garments designed to provide support for muscle and joint stiffness and soreness, as well as aid in recovery and performance by supporting improved circulation and oxygenation. Compression garments have long been known for providing muscle and circulatory support. Some studies indicate athletes can run longer with less pain, and recover faster, and many athletes and celebrities swear by their compression sleeves claiming they have more energy, their muscles work more efficiently, and they avoid injury while exercising. Whether you are an accomplished athlete or a person with an active lifestyle, Copper Fit copper-infused Compression Knee Sleeves may help prevent strain and fatigue by keeping your muscles warm. Made of a high quality polyester and spandex blend with a high-wicking composition, Copper Fit copper-infused Compression Knee Sleeves are designed to help you move more comfortably through your day. The natural properties of copper help protect the garment from odor causing bacteria and stains while the wicking property pulls sweat away from the skin. Copper Fit. Live Limitless. NOTE: compression garments are only effective when they are being worn and properly sized. INSTRUCTIONS: Measure the circumference of your thigh, approximately 5'' above the center of your knee. You may need to adjust the sleeve a few inches up or down to get the desired compression and comfort. Medium 15.5&quot; 16.5&quot; Large 17&quot; 19&quot; XL 19.5&quot; 21&quot; XXL 21.5&quot; 23&quot;","I bought this for my husband who had knee surgery several years ago. After an hour commute each day, his knee aches. After a couple of hours of wearing his CopperFit in the evenings, he gets very respectable relief. He tried wearing it all day once day, but the band wanted to roll down once at the top creating an uncomfortable bind after a while. He says it might just be that he should have noticed the fold earlier, but he has decided to just wear it a few hours at night. For the money, this has been a wonderful solution to his achy knee issue. I thought it a good investment and bought a second one. Worth the money if it makes my husband happy."
"Mueller Reversible Splint Wrist Brace, 1.0 CT",$9.84,4.1/5.0,https://www.walmart.com/ip/Mueller-Reversible-Splint-Wrist-Brace-1-0-CT/10533506,"Get the support you need with this Mueller Sport Care Reversible Wrist Brace. Its unique, adjustable and reversible design is ideal for addressing symptoms associated with carpal tunnel syndrome. Inside of this package you will find one Mueller wrist brace with a removable splint for firm support and extra padding for comfort. With this item you will enjoy maximum support and protection throughout the day and even at night while you are sleeping.","I bought two of these, one for both hands, since I have carpal tunnel. It fits good, except that it sticks up on hand, on the pinkie side. Which I bought these for work, and the part that sticks up snags onto things like the shelves and peg hooks, which doesn't help."
Wellgate™ PerfectFit Wrist Support for Women Right H  ...,$10.99,4.5/5.0,https://www.walmart.com/ip/Wellgate-PerfectFit-Wrist-Support-for-Women-Right-Hand-1-ct-Box/10533005,"Use for Carpal Tunnel Syndrome, weak, sore, aching, or injured wrists and general rehabilitation. Helps to relieve pain.","I was pretty discouraged when I woke up one day with wrist pain that made using the PC, twisting a cap off, or even opening and closing the car door very uncomfortable. After some research on the internet, I realized that icing and rest were the best remedies. I googled wrist supports and luckily ran across this one. I immediately liked that it was sized for women and was a neutral color, as opposed to one of those big, bulky black contraptions. Ladies, believe it or not, the lining inside is pink - a nice feminine touch! Although light, it is well-constructed and the adjustable Velcro straps make it easy to apply as much or as little pressure as you need; I even slept with it on. Best of all, it holds your wrist in a neutral position that allows the tendons to rest and helps avoid re-injury. I have noticeably improved since I began wearing this wrist support."
"ACE Knee Support, One Size Adjustable",$11.60,4.5/5.0,https://www.walmart.com/ip/ACE-Knee-Support-One-Size-Adjustable/24705305,"The ACE Brand consists of outstanding elastic bandages, braces, supports, and cold &amp; hot therapy products to help you maintain your healthy active lifestyle.","I had purchased this product from a local store and it was nearly twice the price of what Walmart offers. Great value
This brace gives me just the support I need as I have a torn meniscus and allows me to do my daily activities without fear that the knee is going to give out."
"ACE Night Wrist Sleep Support, Moderate-Stabilizing,  ...",$18.68,4.8/5.0,https://www.walmart.com/ip/ACE-Night-Wrist-Sleep-Support-Moderate-Stabilizing-One-Size-Adjustable/19898458,"The ACE Brand Wrist Sleep Support provides comfortable support and protection during the night for those who suffer from carpal tunnel syndrome, or have injured, arthritic, weak or post-cast wrists.","My husband has been wearing this every night since we brought it home and comments every morning how GOOD his hand feels. His arm doesn't fall alseep anymore, his hand isn't super stiff, and isn't swollen like it used to be. You can see a difference between his left and his right. His doc had recommend this because he has damage in his wrists from work and at night he had a tendency to bend his wrist over while he slept causing the problems. Not anymore! Oh, and he said it's very comfortable too!"
"ACE Brand Wrist Support, Adjustable, Black, 1/Pack",$7.59,4.4/5.0,https://www.walmart.com/ip/ACE-Brand-Wrist-Support-Adjustable-Black-1-Pack/19898465,"A little support can go a long way in the ACE Brand Wrist Support. This wrist support slips over your thumb and wraps your wrist to provide low-profile stability during a variety of activities. So whether you're working in the garden or need a touch of support on the job, reach for the reliable comfort of the ACE Brand Wrist Support.",I developed tendonitis in my wrist from lifting weights and used this wrist support daily for a couple weeks to help it heal. It's comfortable and not bulky. It fits well and doesn't interfere with my dress shirt cuffs. My only advice is to allow slack around the thumb otherwise it becomes uncomfortable if wrapped too tight because it will tug at the skin between the thumb and first finger.
KT Tape Original Kinesiology Therapeutic Precut Tape  ...,$9.75,4.7/5.0,https://www.walmart.com/ip/KT-Tape-Original-Kinesiology-Therapeutic-Precut-Tape-Strips-Blue/41113778,"Sports Tape, Elastic, Original, Precut Strips, Blue 20 strips Inside the Box: Roll of 20 precut strips; basic instructions. Kinesiology therapeutic tape. Elastic sports tape for pain relief and support. Endorsed by Gold Medalist Kerri Walsh. Join the Community: kttape.com/forum; facebook.com/kttape; twitter.com/kttape. Watch the videos: kttape.com/instructions. Synthetic. Elastic sports tape. Cotton: Elastic sports tape. For pain relief and support. Prevent injury recover faster. Play harder. For Common Injuries: carpal tunnel, hamstring strain, wrist pain, runner's knee, neck strain, calf strain, shoulder pain, Achilles tendonitis, tennis elbow, plantar fasciitis, golfer's elbow, shin splints, rib pain, ankle sprain, gluteus pain, quad strain. www.kttape.com. Cotton or Synthetic? Cotton: Comfortable to wear; 1-3 days of wear; good level of support. Synthetic: comfortable to wear; 4-7 days of wear; best level of support; reflective safety print; protective case; water proof. Made in China. Discontinue use if skin becomes irritated or sore. Instructions provided are for educational use only. KT Tape is not a replacement for professional medical care. Cancer patients should not use KT Tape as it may interfere with treatment. Do not use on abdomen if pregnant. 20 strips Orem, UT Lumos Inc.",Be sure to clean the skin with alcohol before applying if you want it to stick for more than one day.
"Remedy Calf Compression Running Sleeve Socks, Availa  ...",$6.99,3.7/5.0,https://www.walmart.com/ip/Remedy-Calf-Compression-Running-Sleeve-Socks-Available-in-Multiple-Sizes-and-Colors/36932133,"Remedy Calf Compression Sleeves may help increase circulation, reduce swelling, support muscle stability and aid in recovery. Wear while walking, running, working out or doing everyday activities. The support features v-shaped chevron ribbing on the back of the sleeve. Sold as a pair, these calf compression sleeves are moisture wicking, ensuring they stay dry and lightweight. A seamless design means no irritating tags or seams to cause discomfort. The compression in each sleeve provides support for muscles and joints, and helps relieve everyday aches and pains. To properly determine the correct size, measure your calf at the widest point.","I like these, I only need them for one leg so I will have a spare when this one wears out. (they come in pairs) The only thing I wish would be the price would be better and that they could perhaps come in multi-color packs. Sizing is accurate, these are tight (they are supposed to be) I would suggest reading the sizing carefully and be certain your calf especially falls within the size that matches. These are not solid in color, since they are primarily used by runners they have a silver reflective striping down the length of them. (I assume they are for being seen better at night by passing cars)"
