"ACE Plantar Fasciitis Sleep Support, One Size Adjust  ...",$19.16,3.7/5.0,https://www.walmart.com/ip/ACE-Plantar-Fasciitis-Sleep-Support-One-Size-Adjustable/19898460,"The ACE Brand consists of outstanding elastic bandages, Braces, supports, and cold &amp; hot therapy products to help you maintain your healthy active lifestyle.","It took me several days and different strap positions and tightnesses to work out a configuration that wouldn't slip at night. It is very comfortable, I don't even notice it at night..even on warm nights and best of all, I don't wake up in the morning and hobble around..I am able to walk normally on it!"
Mueller Maximum Support Level Self-Adjusting Knee St  ...,$14.88,3.8/5.0,https://www.walmart.com/ip/Mueller-Maximum-Support-Level-Self-Adjusting-Knee-Stabilizer/10533466,"When your knees are in need of extra support, slip on the Mueller Self-Adjusting Knee Brace Stabilizer so you can walk, run and play without the knee pain. This knee brace is self-adjusting, so you get a customized fit. Perfect for athletes of all levels, this lightweight knee stabilizer is made of breathable material, so its comfortable to wear for workouts, sports games or even just spending the day walking at an amusement park. Made from comfy elastic, the Elastic Knee Brace Support Stabilizer can be used if youre recovering from a knee injury or surgery. The fully-trimmed edges help prevent chaffing, so youre skin doesnt get irritated and you enjoy all-day comfort. With a unique design, this self-adjusting knee brace has two flexible steel springs that give extra support as you move. Plus, the opening at the patella keeps pressure off your kneecaps. For all-day knee support, the Elastic Knee Support Stabilizer has you covered.","This is the only Support Brace I wear. I am a big guy and it's difficult to find something to stabilize my knee; this one size fits all is a crock; however, with this knee stabilizer it fits both my knees perfectly, gives me support, actually brings me relief."
Zipper Medical Compression Socks With Open Toe - Bes  ...,$14.95,5.0/5.0,https://www.walmart.com/ip/Zipper-Medical-Compression-Socks-With-Open-Toe-Best-Support-Zipper-Stocking-for-Varicose-Veins-Edema-Swollen-or-Sore-Legs-Size-L-Beige/788608324,"<p>Do you want to end your days with hot, achy, or swollen feet/ legs? Our <strong>thigh high compression stockings</strong> reduce leg pain and tiredness through carefully engineered graduated compression. These men/ <strong>women thigh high compression socks</strong>, are designed especially for people, suffering from any of the following conditions:</p> <ul>  <li>Tired Legs (Leg Fatigue)</li>  <li>Aching Feet</li>  <li>Swollen Ankles</li>  <li>Varicose Veins</li>  <li>Lymph edema</li>  <li>Sore Muscles</li> </ul> <p>Additionally, <strong>open toe compression stockings</strong> work by exerting pressure on the legs and thereby increase venous blood flow. You will notice an immediate difference when you start to use <strong>Compression medium beige stockings, </strong>exclusively manufactured for the assured comfort.</p> <p><strong>Remember to remove jewelry before wearing these stockings!!!</strong></p> <p><strong>Size Chart:- SEE PRODUCT IMAGES FOR FULL SIZING CHART</strong></p> <p><strong>Being comfortable in design, men/<strong>women thigh high compression socks</strong> with open toe design ensure that your feet are never compressed or restricted in any way. Even, our supportive <strong>thigh length compression stockings</strong> provide 20 - 30 mmHg pressure. Get relief from your aching legs or feet and swollen ankles!!!</strong></p> <p><strong><strong>Specifications for Open toe compression stockings:</strong></strong></p> <p><strong><strong>GRADUATED COMPRESSION DESIGNED </strong>for varicose and spider veins, diabetic symptoms, long flights, standing for extended periods, maternity, pregnant mothers and general inflammation or swelling of the legs and feet</strong></p> <p><strong><strong>REDUCE LEG FATIGUE</strong> - Therapeutic Graduated 20 - 30 mmHg Pressure Provides Relief for Aching Legs and Feet and Swollen Ankles</strong></p> <p><strong><strong>OPEN TOE DESIGN</strong> for comfort and to ensure your feet is not compressed or restricted in any way. Toeless fits all foot sizes.</strong></p> <p><strong><strong>NON-SLIP DESIGN</strong> - Stays in place all day thanks to a silicone band around the top. Won't curl like some brands can.</strong></p> <p><strong>These <strong>thigh length compression stockings</strong> are designed to help improve circulation and energize and revitalize the legs - ideal when sitting or standing for extended periods. Even Our women/<strong>men thigh compression stocking </strong>provide controlled compression for keeping feet and legs relaxed. Thats why; these unisex <strong>thigh high compression stockings </strong>are a great way to prevent and treat venous disorders.</strong></p> <p><strong><strong>Note:</strong> If you dont like then we offer a 30-day money back guarantee on all our products, so that you can always have peace of mind when placing an order.</strong></p>","I bought these socks, and they have lived up to my expectations. The zipper makes dressing a lot easier. I zip mine, put them in a lingerie bag, and wash them in the machine on medium. I dry on medium. I am sure they would last even longer if I followed instructions. For me, wearing them eliminates the weeping and cuts down on the swelling. Packaging is good, and delivery is fast. I recommend this product."
"ACE Brand Elastic Bandage w/ clips, 6 in",$7.47,4.8/5.0,https://www.walmart.com/ip/ACE-Brand-Elastic-Bandage-w-clips-6-in/19898437,"ACE Brand Elastic Bandages are designed to provide support and compression during recovery and return to activity. They are comfortable to wear for extended periods of time, easy to use, and adjustable for a custom fit.","My boys play college Rugby. It can be a rough sport. The boys love the exercise, challege, and team effort. Every season inevitably several of the guys on the team will suffer some kind of injury. At this point I will hop into action accessing the complaint and administering first aid. Every game I bring a first aid bag. One of the key essentials is ace bandages. Thank goodness for ace bandage. They are quick and easy to apply at any location and under
any adverse weather condition. Ace bandage is a wonderful product."
Compression Socks for Men & Women - Graduated Knee-H  ...,$19.99,0.0/5.0,https://www.walmart.com/ip/Compression-Socks-Men-Women-Graduated-Knee-High-compression-Stockings-relieve-calf-leg-foot-pain-FDA-Registered-Nurse-Runner-recommended-S-M-L-XL/611895836,"Trying to find a pair of compression socks which will prevent foot and leg pain when exercising or from being on your feet all day? Need medical grade socks which are easy enough to get on, yet remain tight and comfortable to wear for long periods of time? Need effective relief from conditions such as varicose veins, shin splints, swelling or other calf and foot pain? Treat My Feet Graduated compression socks are medical grade and are tailored to provide graduated support to the right areas from the ball, right around the foot and up through the calf, significantly improving blood circulation aiding recovery and relieving pain. These compression socks are comfortable to wear; not too tight, yet tight enough to ensure that you are suffering no ill-effects after a long workout or being on your feet after a long shift. Perfect to help aid recovery after surgery. Check out the benefits: Unique combination of nylon and spandex for super-soft feeling, no itching or rubbing, and anti-odor protection. Simply wash and leave to air dry, and material wont lose any compression Improved athletic performance, youll be able to run further and faster without suffering calf or foot pain, and decrease recovery time in between workouts No need to worry about DVT if you are a frequent traveler Stylish design means you wont be embarrassed wearing them. Were so confident youll love our Treat My Feet compression socks that if you dont, well refund your money, no questions asked. Click Add to Cart at the Top of the Page, and look forward to no aching feet at the end of the day, relief from varicose veins, and no swollen legs! Buy another pair for when one set is being washed!","Great look! Great feel! Unfortunately, these are falling apart. Have washed them once (air dry) and wore them twice. The stitching is coming apart between the bands of colors. Too bad, as I have already received complements on them!"
"Copper Fit Compression Knee Sleeve, X-Large",$9.88,3.1/5.0,https://www.walmart.com/ip/Copper-Fit-Compression-Knee-Sleeve-X-Large/38573956,"This As Seen on TV Copper Fit Knee Compression Sleeve in XL is designed to relieve pain in stiff and sore knees! It can also be used to help reduce muscle pain from a knee injury. The sleeve is lightweight and comfortable to wear and tough enough for an active lifestyle. It is specially designed to remove sweat from the body and prevent chafing and rashes for added convenience. This knee support sleeve is made with a high-performance compression fabric and is blended with therapeutic copper that is essential to your body. The two technologies combine to help reduce recovery time and speed up the healing process, so you can perform at your best again. It does not contain neoprene, so it won't cause allergic reactions. To determine if this XL As Seen on TV knee sleeve will fit you, simply measure the circumference of your thigh (5&quot; up from knee) above the center of the knee and see if you fall in this range: 19-1/2&quot; to 21&quot;.","Got this for my husband.  He is very satisfied.  He can't wear it all day because it seems to tighten up as the day goes on.  It does make walking easier and holds down the pain while it's on.  It's everything he expected it to be and, most importantly, the price was right."
"Copper Fit Compression Knee Sleeve, Medium",$8.99,3.6/5.0,https://www.walmart.com/ip/Copper-Fit-Compression-Knee-Sleeve-Medium/38573957,"Copper Fit Compression Knee Sleeves are the copper-infused compression garments designed to provide support for muscle and joint stiffness and soreness, as well as aid in recovery and performance by supporting improved circulation and oxygenation.  <br />  <p>Compression garments have long been known for providing muscle and circulatory support. Some studies indicate athletes can run longer with less pain, and recover faster, and many athletes and celebrities swear by their compression sleeves claiming they have more energy, their muscles work more efficiently, and they avoid injury while exercising. <br /> </p> <p>Whether you are an accomplished athlete or a person with an active lifestyle, Copper Fit copper-infused Compression Knee Sleeves may help prevent strain and fatigue by keeping your muscles warm. <br /> </p> <p>Made of a high quality polyester and spandex blend with a high-wicking composition, Copper Fit copper-infused Compression Knee Sleeves are designed to help you move more comfortably through your day. The natural properties of copper help protect the garment from odor causing bacteria and stains while the wicking property pulls sweat away from the skin. <br /> </p> <p>Copper Fit. Live Limitless. <br /> </p> <p>NOTE: compression garments are only effective when they are being worn and properly sized. <br /> </p> <p>Instructions: Measure the circumference of your thigh, approximately 5'' above the center of your knee. You may need to adjust the sleeve a few inches up or down to get the desired compression and comfort. <br /> Medium 15.5 16.5 <br /> Large 17 19 <br /> XL 19.5 21 <br /> XXL 21.5 23</p>","When i opened this package i had 2 chuckle ciz i thought ""how is this thing going to help my knee?"". Much to my suprisethis is the best knee brace i have ever put on my leg! Absolutely no pain while wearing it!  I would highly recommend this product to any one with knee discomfort."
Zipper Pressure Compression Socks Support Stockings   ...,$10.95,4.0/5.0,https://www.walmart.com/ip/Zipper-Pressure-Compression-Socks-Support-Stockings-Leg-Open-Toe-Knee-High-20-30mmHg-Helps-Circulation-Varicose-Veins-Swollen-Legs-Zipper-Nude-Regula/338023839,"<p>Zip leg pain away for instant relief, increase circulation and reduce swelling! The soft and comfortable Zipper Compression Socks are designed to increase blood circulation and reduce swelling. These soft, breathable and comfortable compression socks are made with nylon and spandex for maximum comfort. The zipper compression knee-high socks feature a pinch-resistant zipper that makes for easy wear &amp; removal. The toe-less design accommodates large shoe sizes and provides quick access for all your needs. Knee length, made from nylon and spandex. FDA listed. </p>",I bought these stockings for my mom and she loves them she says they fit great and makes her legs feel great.
"ACE Brand Deluxe Ankle Stabilizer, Adjustable, Black  ...",$9.08,4.3/5.0,https://www.walmart.com/ip/ACE-Brand-Deluxe-Ankle-Stabilizer-Adjustable-Black-1-Pack/19898432,"Sometimes, all you need to stay in the game is a bit of support, and thats just what the ACE Brand Deluxe Ankle Stabilizer gives you. Built tough with reinforced stabilizers, this durable brace offers the support and protection you need to participate in your favorite sports. The three-strap system easily adjusts to match your activity, and breathable materials allow airflow. When youre on the track, court or field, take two steps forward with the ACE Brand Deluxe Ankle Stabilizer.","This is a well-designed ankle splint with stiff side supports and three Velcro closures. There is a strap around the calf at the top of the splint and two straps around the ankle that cross-cross in front. This allows for infinite adjustment and excellent fit. I did find that I initially needed an ace wrap from the foot up to the calf to decrease swelling, but the splint fit right over the ace wrap. Now I am just wearing an athletic sock under the splint. This splint is comfortable for walking and low profile so that it fits into the same size sneaker that I normally wear."
"ACE Compression Knee Support, Extra Large",$5.59,4.4/5.0,https://www.walmart.com/ip/ACE-Compression-Knee-Support-Extra-Large/19898451,"The ACE Brand consists of outstanding elastic bandages, braces, supports, and cold &amp; hot therapy products to help you maintain your healthy active lifestyle.","This product is to skimpy for length. They crawl out of position when walking, etc. Walmart has a very satisfactory pair (Spalding) in the sporting goods department although they don't carry an Ex Large size. I'm very happy with the Spalding and wish I had not purchased the Ace!"
Copper Fit elbow Sleeve Compression Sleeve Pro Serie  ...,$7.99 - $8.99,0.0/5.0,https://www.walmart.com/ip/Copper-Fit-elbow-Sleeve-Compression-Sleeve-Pro-Series-Sport-elbow-Brace-Unisex-XL/795941999,<b>Product Description</b> <br />82% Polyester and 14% Spandex Jersey and 4% Copper Ion Fiber with high-wicking modacrylic fiber compositionThe natural properties of copper help protect the garment from bacteria which cause odors and stainsAnti-static and Anti-pilling <br /> <br /> <b>Features and Benefits</b> <br />Kinesiology compression bands are strategically patterned in the garment to target known pain center points <br />Helps relieve pain and inflammation <br />Improves recovery &amp; performance <br />Guaranteed relief of muscle aches and pains or your money back <br /> <br />Measure the circumference of your thigh approximately 5&quot; above the center of your knee. L is 17&quot;-19&quot; and XL is 19.5&quot;-21&quot;. You may need to adjust the sleeve a few inches up or down to get the desired compression and comfort.This auction is for 1 sleeve.,I have used copper fit for years and the pro series did not fit it was real loose and material seemed cheaper made.  The size was incorrect tried returning or exchanging and still have not heard back from the company.
ACE Knitted Compression Knee Brace featuring Side St  ...,$6.76 - $12.04,4.4/5.0,https://www.walmart.com/ip/ACE-Knitted-Compression-Knee-Brace-featuring-Side-Stabilizers-Large-White-Gray-1-pack/19898447,"ACE Brand Compression Knee Brace with Side Stabilizers, Large, White/Gray, 1/Pack. Better, stronger, faster is your motto, and we're here to support it. The ACE Brand Knee Brace with Side Stabilizers simulates the action of the natural knee ligaments without restricting normal knee movement. Get back to running, jumping and dodging your opponent with ACE Brand knee supports.",These knee braces are awesome. I only wear during the day when I do most of my walking and other activities
As Seen On Tv Sock Slider - The Fastest Easiest Way   ...,$14.19,3.7/5.0,https://www.walmart.com/ip/As-Seen-On-Tv-Sock-Slider-The-Fastest-Easiest-Way-To-Put-Socks-On/770044010,,"idea is good, design not so much, instructions hopeless, quality even less so.  I have trouble fitting sock onto gadget, yet more trouble keeping gadget in place whilst inserting foot. With outside help it works but help might as well put sock on for me.  Bought mine on in store sale at just $3, not worth the gas to return.it for that"
