"ACE Knee Brace with Dual Side Stabilizers, Adjustabl  ...",$14.94,4.2/5.0,https://www.walmart.com/ip/ACE-Knee-Brace-with-Dual-Side-Stabilizers-Adjustable-Black-Gray/19898440,"The ACE Brand Knee Brace with Dual Side stabilizers delivers reliable stability so you can stay active with the ones you care about Whether youve got a nightly walking date with Fluffy or a weekly gym meetup with your best friend, our knee brace hugs your knee with comfortable compression to stabilize your weak or sore muscles and joints Adjustable features offer the perfect fit Youre a person of your wordso keep those dates with the help of the ACE Brand Knee Brace with Dual Side stabilizers",Walmart #  550365890
"ACE Brand Reversible Splint Wrist Brace, Adjustable,  ...",$9.99,4.5/5.0,https://www.walmart.com/ip/ACE-Brand-Reversible-Splint-Wrist-Brace-Adjustable-Gray-1-Pack/23598249,"When your wrist feels wonky, reach for the stabilizing support of the ACE Adjustable Reversible Splint Wrist Brace This wrist brace allows you to wear it on either wrist for lasting use Multiple straps help you achieve your desired amount of support, and the ergonomic design lets you retain full mobility in your fingers Slip on the supportive comfort of the ACE Adjustable Reversible Splint Wrist Brace",Walmart #  4003625
"ThermaCare Advanced Back Pain Therapy (2 Count, S-M   ...",$5.94$2.97/each,4.6/5.0,https://www.walmart.com/ip/ThermaCare-Advanced-Back-Pain-Therapy-2-Count-S-M-Size-Heatwraps-16-Hours-Pain-Relief-Lower-Back-Hip-Use-Temporary-Relief-Muscular-Joint-Pains/13269725?wpa_bd=&wpa_pg_seller_id=F55CDC31AB754BB68FE0B39041159D63&wpa_ref_id=99882906c1623361668a1760aa49f319&wpa_aux_info=__aux_info__&wpa_tag=&wpa_pos=3&wpa_plmt=__plmt__&wpa_aduid=__aduid__,"16 Hour Pain Relief from Lower Back Pains &amp; Hip Pains Unlike other creams, rubs and patches, which create sensations on your skin to mask pain, ThermaCare Heatwraps use real heat therapy to accelerate healing and relieve pain at the source for up to 8 hours, and once removed, another 8 hoursthats 16 hours of relief from aches and pains How To Use: 1 Ensure skin in application area is clean, dry and free of makeup, recently applied skin moisturizer, lotions and other topical analgesics 2 Position wrap flat on your skin and ensure the darker heat cells are placed towards skin 3 Use care when handling the wrap to prevent overtightening1 1 Read full product labeling for complete usage instructions",Walmart #  004052664
Mueller Adjustable Ankle Stabilizer,$12.97,3.9/5.0,https://www.walmart.com/ip/Mueller-Adjustable-Ankle-Stabilizer/10533462,Fully adjustable design provides customer fit and firm compression ideal for sprained strained and arthritic ankles,Walmart #  4098966
"MediPeds Compression Over the Calf, Medium, 2-Pack",$8.98,3.6/5.0,https://www.walmart.com/ip/MediPeds-Compression-Over-the-Calf-Medium-2-Pack/46629650?wpa_bd=&wpa_pg_seller_id=F55CDC31AB754BB68FE0B39041159D63&wpa_ref_id=c4ae5307098a14ec14f25941fa41b525&wpa_aux_info=__aux_info__&wpa_tag=&wpa_pos=5&wpa_plmt=__plmt__&wpa_aduid=__aduid__,"Get the supportive compression that helps relieve swelling and tired, achy legs with the MediPeds Compression Over the Calf, 2Pack These MediPeds socks have stretch fiber hugs your foot for perfect fit and a smooth toe seam that reduces pressure points These socks have stretch fiber that hugs your foot for better fit and comes in a convenient pack of two",Walmart #  553404779
Mueller Lumbar Back Brace,$16.69,4.1/5.0,https://www.walmart.com/ip/Mueller-Lumbar-Back-Brace/10533468,"Get ready to enjoy all of your normal daily activities with the Mueller Lumbar Back Brace It helps relieve the pain from strains, sprains and muscle spasms The double layer design in this adjustable lumbar back brace allows for a custom fit It is made to give helpful compression to the abdomen and lower back The Mueller brace works to provide relief from injuries and strenuous movements to keep you going The breathable fabric is designed for comfortable allday wear It features a removable pad that cushions and holds well for concentrated support The four flexible steel springs conform to your body A tapered cut ensures a snug fit for men and women It has outer elastic straps made for strong customized tension The main elastic band widens in the rear for broad coverage/p bMueller Lumbar Back Brace:/b",Walmart #  004054235
"Copper Fit Back Support, size 39""-50""",$14.00,3.6/5.0,https://www.walmart.com/ip/Copper-Fit-Back-Support-size-39-50/43723172,"Enjoy the support and relief offered by this AsSeenonTV CopperFit Back Pro LXL The strength of its compression technology provides more confidence during movement Wear this copperinfused back brace under everyday clothing and sports outfits to apply firm pressure to your lower back muscles as you walk, stretch, bend and run Adjustable straps allow you to find a custom fit for the right hold and continuous comfort The moisturewicking fabric of this copperinfused back support helps absorb sweat and odors to keep you dry and confident on your most active days Its strong hold allows a greater degree of mobility Forget all about this lightweight band after you quickly wrap it around your middle Its contoured shape flattens your belly area as the brace hugs you discreetly under any clothing A unisex look makes the AsSeenonTV CopperFit Back Pro LXL a wonderful gift for men and women with a busy, highenergy lifestyle",Walmart #  550970984
"Copper Fit Back Support, size 28""-39""",$9.88 - $14.88,4.4/5.0,https://www.walmart.com/ip/Copper-Fit-Back-Support-size-28-39/51938211,"Copper Fit Back Support is a copperinfused compression garment designed to provide everyday support, comfort and relief for lower back and abdominal muscles Featuring a slim, lightweight design, The Copper Fit Back Support allows for increased mobility and fits discreetly under your clothes Made of a high quality polyester and spandex blend with a highwicking composition, Copper Fit copperinfused Back Support is designed to help you move more comfortably through your day The natural properties of copper help protect the garment from odor causing bacteria and stains while the wicking property pulls sweat away from the skin Simply adjust the Velcro closure for a quick ; easy custom fit that delivers comfort, compression and support throughout your work out or work day Copper Fit Live Limitless NOTE: compression garments are only effective when they are being worn and properly sized SIZE: Small/Medium: fits waist sizes 28&amp; 8221;&amp; 8211; 39&amp; 8221; Large/XLarge: fits waist sizes 39&amp; 8221;&amp; 8211; 50&amp; 8221;",Walmart #  555665619
"Copper Hands Compression Gloves, S/M",$12.88 - $15.20,3.4/5.0,https://www.walmart.com/ip/Copper-Hands-Compression-Gloves-S-M/39263700,"Make sure that you stay active when you have these Copper Hands Compression Gloves Theyre stylish and designed with several infused embellishments Copper Hands gloves provide soothing relief when you put them on They give you comfort and support for wrists, fingers and hands while helping to eliminate pain The ultralight breathable fabric is suitable for yearround use Plus, the open fingertips are helpful for using any touchscreen device like a smartphone or tablet These arthritis gloves are handy for working on your favorite hobbies, completing common household tasks like opening jars and much more Theyre available in your choice of assorted sizes   /",Walmart #  552997888
ACE Moderate-Stabilizing Support Adjustable Back Bra  ...,$14.37,4.5/5.0,https://www.walmart.com/ip/ACE-Moderate-Stabilizing-Support-Adjustable-Back-Brace-Black-Gray/23598250,Put in a hard days work or a game well played with an ACE Back Brace Odor resistant support The adjustable Brace supports your lumbar and abdominal area,Walmart #  564117430
"ACE Brand Elastic Bandage w/ clips, 3 in",$2.89,4.8/5.0,https://www.walmart.com/ip/ACE-Brand-Elastic-Bandage-w-clips-3-in/19898439,"ACE Brand Elastic Bandages are designed to provide support and compression during recovery and return to activity They are comfortable to wear for extended periods of time, easy to use, and adjustable for a custom fit",Walmart #  550365856
ACE Adjustable Hinged Knee Brace Allows Safe Motion   ...,$18.99,3.9/5.0,https://www.walmart.com/ip/ACE-Adjustable-Hinged-Knee-Brace-Allows-Safe-Motion-and-Strong-Lateral-Stabilization-and-Support-Black/47070932,"Get quality performance from a trusted name in health and wellness with the ACE Adjustable Hinged Knee Brace This product is intended to provide firm, stabilizing support for patella tracking after moderate to severe knee injuries It delivers strong, dualpivoting lateral stabilizers with hinged metal that stays ridged to allow for safe motion during activities While its buttress cushioning offers protection and stability for the kneecap The hook and loop cinch straps easily wrap around your knee to make a simple adjustment for a customizable fit This item is ideal for providing extra support of an unstable joint with the added benefit of heat retention The black, knee stabilizer brace is constructed of a wraparound, neoprene blended material that wont strangle the leg like typical slipon types",Walmart #  565085939
"Copper Fit Compression Knee Sleeve, Large",$9.88,3.8/5.0,https://www.walmart.com/ip/Copper-Fit-Compression-Knee-Sleeve-Large/38573958,"Copper Fit Compression Knee Sleeves are copperinfused compression garments designed to provide support for muscle and joint stiffness and soreness, as well as aid in recovery and performance by supporting improved circulation and oxygenation Compression garments have long been known for providing muscle and circulatory support Some studies indicate athletes can run longer with less pain, and recover faster, and many athletes and celebrities swear by their compression sleeves claiming they have more energy, their muscles work more efficiently, and they avoid injury while exercising Whether you are an accomplished athlete or a person with an active lifestyle, Copper Fit copperinfused Compression Knee Sleeves may help prevent strain and fatigue by keeping your muscles warm Made of a high quality polyester and spandex blend with a highwicking composition, Copper Fit copperinfused Compression Knee Sleeves are designed to help you move more comfortably through your day The natural properties of copper help protect the garment from odor causing bacteria and stains while the wicking property pulls sweat away from the skin Copper Fit Live Limitless NOTE: compression garments are only effective when they are being worn and properly sized INSTRUCTIONS: Measure the circumference of your thigh, approximately 5 above the center of your knee You may need to adjust the sleeve a few inches up or down to get the desired compression and comfort Medium 155&quot; 165&quot; Large 17&quot; 19&quot; XL 195&quot; 21&quot; XXL 215&quot; 23&quot;",Walmart #  552482482
"Mueller Reversible Splint Wrist Brace, 1.0 CT",$9.84,4.1/5.0,https://www.walmart.com/ip/Mueller-Reversible-Splint-Wrist-Brace-1-0-CT/10533506,"Get the support you need with this Mueller Sport Care Reversible Wrist Brace Its unique, adjustable and reversible design is ideal for addressing symptoms associated with carpal tunnel syndrome Inside of this package you will find one Mueller wrist brace with a removable splint for firm support and extra padding for comfort With this item you will enjoy maximum support and protection throughout the day and even at night while you are sleeping",Walmart #  4005304
Wellgate™ PerfectFit Wrist Support for Women Right H  ...,$10.99,4.5/5.0,https://www.walmart.com/ip/Wellgate-PerfectFit-Wrist-Support-for-Women-Right-Hand-1-ct-Box/10533005,"Use for Carpal Tunnel Syndrome, weak, sore, aching, or injured wrists and general rehabilitation Helps to relieve pain",Walmart #  4071862
"ACE Knee Support, One Size Adjustable",$10.95,4.5/5.0,https://www.walmart.com/ip/ACE-Knee-Support-One-Size-Adjustable/24705305,"The ACE Brand consists of outstanding elastic bandages, braces, supports, and cold &amp; hot therapy products to help you maintain your healthy active lifestyle",Walmart #  564151599
"ACE Night Wrist Sleep Support, Moderate-Stabilizing,  ...",$18.68,4.8/5.0,https://www.walmart.com/ip/ACE-Night-Wrist-Sleep-Support-Moderate-Stabilizing-One-Size-Adjustable/19898458,"The ACE Brand Wrist Sleep Support provides comfortable support and protection during the night for those who suffer from carpal tunnel syndrome, or have injured, arthritic, weak or postcast wrists",Walmart #  4003709
"ACE Brand Wrist Support, Adjustable, Black, 1/Pack",$7.59,4.4/5.0,https://www.walmart.com/ip/ACE-Brand-Wrist-Support-Adjustable-Black-1-Pack/19898465,"A little support can go a long way in the ACE Brand Wrist Support This wrist support slips over your thumb and wraps your wrist to provide lowprofile stability during a variety of activities So whether youre working in the garden or need a touch of support on the job, reach for the reliable comfort of the ACE Brand Wrist Support",Walmart #  550365916
"Band-Aid Brand First Aid Medical Paper Tape, 1 in by  ...",$2.60,0.0/5.0,https://www.walmart.com/ip/Band-Aid-Brand-First-Aid-Medical-Paper-Tape-1-in-by-10-yd-2-ct/947114536,"BandAid Brand of First Aid Products HurtFree Medical Adhesive Paper Tape firmly secures gauze and wound dressings in place without causing irritation Ideal for frequent dressing changes, this medical adhesive tape stays in place and is painless to remove The breathable first aid tape is gentle on the skin and is dermatologically tested to be nonirritating It also tears easily off the roll This first aid tape is not made with natural rubber latex and is from the 1 doctor recommended first aid brand",Walmart #  557968947
"Remedy Calf Compression Running Sleeve Socks, Availa  ...",$6.99,3.7/5.0,https://www.walmart.com/ip/Remedy-Calf-Compression-Running-Sleeve-Socks-Available-in-Multiple-Sizes-and-Colors/36932133,"Remedy Calf Compression Sleeves may help increase circulation, reduce swelling, support muscle stability and aid in recovery Wear while walking, running, working out or doing everyday activities The support features vshaped chevron ribbing on the back of the sleeve Sold as a pair, these calf compression sleeves are moisture wicking, ensuring they stay dry and lightweight A seamless design means no irritating tags or seams to cause discomfort The compression in each sleeve provides support for muscles and joints, and helps relieve everyday aches and pains To properly determine the correct size, measure your calf at the widest point",Walmart #  552719855
"ACE Plantar Fasciitis Sleep Support, One Size Adjust  ...",$19.16,3.7/5.0,https://www.walmart.com/ip/ACE-Plantar-Fasciitis-Sleep-Support-One-Size-Adjustable/19898460,"The ACE Brand consists of outstanding elastic bandages, Braces, supports, and cold &amp; hot therapy products to help you maintain your healthy active lifestyle",Walmart #  566785799
Mueller Maximum Support Level Self-Adjusting Knee St  ...,$14.88,3.9/5.0,https://www.walmart.com/ip/Mueller-Maximum-Support-Level-Self-Adjusting-Knee-Stabilizer/10533466,"When your knees are in need of extra support, slip on the Mueller SelfAdjusting Knee Brace Stabilizer so you can walk, run and play without the knee pain This knee brace is selfadjusting, so you get a customized fit Perfect for athletes of all levels, this lightweight knee stabilizer is made of breathable material, so its comfortable to wear for workouts, sports games or even just spending the day walking at an amusement park Made from comfy elastic, the Elastic Knee Brace Support Stabilizer can be used if youre recovering from a knee injury or surgery The fullytrimmed edges help prevent chaffing, so youre skin doesnt get irritated and you enjoy allday comfort With a unique design, this selfadjusting knee brace has two flexible steel springs that give extra support as you move Plus, the opening at the patella keeps pressure off your kneecaps For allday knee support, the Elastic Knee Support Stabilizer has you covered",Walmart #  004042143
"Copper Fit Compression Elbow Sleeve, Medium",$8.75,4.0/5.0,https://www.walmart.com/ip/Copper-Fit-Compression-Elbow-Sleeve-Medium/51933662,"The Copper Fit Elbow Sleeve is made for painful, stiff, sore and working elbows Its flexible compression facilitates your movement and warms your muscles to keep them ready for action The copperinfused polyester sleeve dries quickly and dampens odors for lasting freshness and a lightweight feel",Walmart #  555665599
"ACE Brand Elastic Bandage w/ clips, 6 in",$7.47,4.8/5.0,https://www.walmart.com/ip/ACE-Brand-Elastic-Bandage-w-clips-6-in/19898437,"ACE Brand Elastic Bandages are designed to provide support and compression during recovery and return to activity They are comfortable to wear for extended periods of time, easy to use, and adjustable for a custom fit",Walmart #  550365857
"Copper Fit Compression Knee Sleeve, Medium",$8.61,3.6/5.0,https://www.walmart.com/ip/Copper-Fit-Compression-Knee-Sleeve-Medium/38573957,"Copper Fit Compression Knee Sleeves are the copperinfused compression garments designed to provide support for muscle and joint stiffness and soreness, as well as aid in recovery and performance by supporting improved circulation and oxygenation   /  Compression garments have long been known for providing muscle and circulatory support Some studies indicate athletes can run longer with less pain, and recover faster, and many athletes and celebrities swear by their compression sleeves claiming they have more energy, their muscles work more efficiently, and they avoid injury while exercising  / /p Whether you are an accomplished athlete or a person with an active lifestyle, Copper Fit copperinfused Compression Knee Sleeves may help prevent strain and fatigue by keeping your muscles warm  / /p Made of a high quality polyester and spandex blend with a highwicking composition, Copper Fit copperinfused Compression Knee Sleeves are designed to help you move more comfortably through your day The natural properties of copper help protect the garment from odor causing bacteria and stains while the wicking property pulls sweat away from the skin  / /p Copper Fit Live Limitless  / /p NOTE: compression garments are only effective when they are being worn and properly sized  / /p Instructions: Measure the circumference of your thigh, approximately 5 above the center of your knee You may need to adjust the sleeve a few inches up or down to get the desired compression and comfort  / Medium 155 165  / Large 17 19  / XL 195 21  / XXL 215 23/p",Walmart #  552482483
"ACE Brand Deluxe Ankle Stabilizer, Adjustable, Black  ...",$9.08,4.3/5.0,https://www.walmart.com/ip/ACE-Brand-Deluxe-Ankle-Stabilizer-Adjustable-Black-1-Pack/19898432,"Sometimes, all you need to stay in the game is a bit of support, and thats just what the ACE Brand Deluxe Ankle Stabilizer gives you Built tough with reinforced stabilizers, this durable brace offers the support and protection you need to participate in your favorite sports The threestrap system easily adjusts to match your activity, and breathable materials allow airflow When youre on the track, court or field, take two steps forward with the ACE Brand Deluxe Ankle Stabilizer",Walmart #  550365864
"Copper Fit Compression Ankle Sleeve, Medium",$5.00 - $8.78,1.0/5.0,https://www.walmart.com/ip/Copper-Fit-Compression-Ankle-Sleeve-Medium/51933650,"The Copper Fit Ankle Sleeve is made for painful, stiff, sore and working ankles As seen on TV, the Copper Flex highperformance, compression fabric is blended with therapeutic copper essential to you body to help keep your muscles warm and ready for action The copperinfused polyester sleeve dries quickly and dampens odors for lasting freshness and a lightweight feel",Walmart #  555665578
ACE Knitted Compression Knee Brace featuring Side St  ...,$6.76 - $12.81,4.4/5.0,https://www.walmart.com/ip/ACE-Knitted-Compression-Knee-Brace-featuring-Side-Stabilizers-Large-White-Gray-1-pack/19898447,"ACE Brand Compression Knee Brace with Side Stabilizers, Large, White/Gray, 1/Pack Better, stronger, faster is your motto, and were here to support it The ACE Brand Knee Brace with Side Stabilizers simulates the action of the natural knee ligaments without restricting normal knee movement Get back to running, jumping and dodging your opponent with ACE Brand knee supports",Walmart #  550365896
"ACE Brand Elastic Bandage w/ clips, 4 in",$4.30,4.8/5.0,https://www.walmart.com/ip/ACE-Brand-Elastic-Bandage-w-clips-4-in/19898442,"ACE Brand Elastic Bandages are designed to provide support and compression during recovery and return to activity They are comfortable to wear for extended periods of time, easy to use, and adjustable for a custom fit",Walmart #  550365855
Johnson & Johnson Coach Sports Cloth Tape 1.5 in x 1  ...,$2.52,5.0/5.0,https://www.walmart.com/ip/Johnson-Johnson-Coach-Sports-Cloth-Tape-1-5-in-x-10-yd/10533026,"From the brand recommended by professional athletic trainers, Johnson &amp; Johnson Coach Cloth Sports Tape protects joints from sprains and other injuries This breathable first aid cloth tape also provides support to help speed recovery after injuries This 15inchby10yard cloth tape is ideal for taping fingers, wrists, and ankles It may be used over a pretaping underwrap",Walmart #  568789327
As Seen On Tv Sock Slider - The Fastest Easiest Way   ...,$9.88,3.8/5.0,https://www.walmart.com/ip/As-Seen-On-Tv-Sock-Slider-The-Fastest-Easiest-Way-To-Put-Socks-On/770044010,"Puts your socks on for you so you dont have to bend far over Unique cradle design expands and holds your sock open Keeps your sock in the perfect position so all you have to do is slide your foot in Makes taking your socks off easy Helps put on your shoes, too",Walmart #  564198222
