"Medical Knee Scooter for Broken Foot by HEALTHLINE,   ...",$139.85,2.0/5.0,https://www.walmart.com/ip/Medical-Knee-Scooter-Broken-Foot-HEALTHLINE-Knee-Walker-Scooter-Handle-Brake-Basket-Crutch-Alternative-Steerable-Terrain-Knee-Scooter-Red/447206001,"The Steerable Knee Walker by Healthline Trading provides a comfortable pain-free alternative to crutches and is ideal for individuals who are recovering from foot surgery, breaks, sprains, amputations and ulcers of the foot. This innovative walker can be easily adjusted without tools to meet your needs, allowing for increased maneuverability. Equipped with large wheels and a durable frame design, the Knee Walker provides maximum control when used indoors or outdoors. This product comes standard with tool-free height-adjustable dual hand brakes, ensuring optimal safety and security when in use. The extra thick leg pad can be height-adjusted and provides increased stability, allowing for a pain-free comfortable experience. One of the greatest features of this knee walker is how easily the unit folds without tools, making travel, storage or just getting around easy.","Came with broken wheel in damaged box. Company will not answer the phone, you can't leave a message. The person who bought me the knee walker managed to talk to them once. He wants pics of the box and wheel and then he will think about replacing it.  So he has tried to contact them again multiple times their message box is full.  The size of the wheel is not stated in this add as in other ads the company has put wheel (caster) size in their ad. Measured the wheel it is 7 1/2 inches do they count that as an 8 inch wheel?  but it sounded like he would not replace the wheel."
KneeRover Kids Knee Walker Child Knee Scooter Pediat  ...,$159.00,4.0/5.0,https://www.walmart.com/ip/KneeRover-Kids-Knee-Walker-Child-Knee-Scooter-Pediatric-Crutch-Alternative-with-Basket-in-Light-Blue/167506644,"<b>KNEEROVER KNEE WALKER JR.</b> <br /> <br />Ideal for kids and small adults recovering from injury or surgery to the foot, ankle or lower leg as well as below the knee amputees. The KneeRover Knee Walker Jr is the industry's first pediatric steerable knee scooter and an excellent alternative to crutches. <br /> <br />Excellent stability and control when maneuvering - these steerable knee walkers offer an adjustable locking handbrake and a rear disc brake. <br /> <br />Fully adjustable handlebars and knee platform, this very lightweight yet sturdy knee walker offers a 160 lb weight capacity and is recommended for children and small adults with heights 3'6&quot; to 5'4&quot;. <br /> <br />","I am 4'11"", so the scooter is a great fit for me.  The turning radius is small and it is easy to operate the brake.  In order for me to give this scooter five stars, they need to change the seat.  The seat has only a channel going from back to front, for your leg to rest in.  They need to add a channel going from side to side, so that when you are sitting down and resting your foot on the seat, it will rest comfortably in the channel of the seat.  Without it, it is too uncomfortable to rest your foot on the seat,  unless it is from back to front.  It is much more convenient to be able to rest your foot from side to side, but not on this seat.  Otherwise, it is a great scooter."
KneeRover HYBRID Knee Walker - Featuring KneeCycle K  ...,$249.00,4.0/5.0,https://www.walmart.com/ip/KneeRover-HYBRID-Knee-Walker-Featuring-KneeCycle-Knee-Scooter-with-Basket-in-Blue/172306030,"The ALL NEW KNEEROVER HYBRID KNEE WALKER  <br /> <br />The Latest Innovation from KneeRover - the #1 Knee Scooter Brand.  <br /> <br />The KneeRover HYBRID is the first knee scooter to feature All Terrain Pneumatic Front wheels in a four wheel design for maximum freedom and stability for individuals recovering from a broken foot, broken ankle, broken leg, foot surgery, ankle surgery or other lower leg injuries or medical conditions like ulcers. <br /> <br />ALL NEW product combines the proven, top rated performance and stability of the KneeCycle with an All Terrain front axle featuring 9 inch pneumatic wheels. <br /> <br />",Would have given this product 5+ but the knee rest is a little weak.  Inflated front tires to 20psi and ran the streets and sidewalks of Orlando with no problems.  Really boogies along and was a dream to ride inside the Amway Center.  Now if KneeRover would only upgrade the knee rest it would be the Cadillac of knee scooters.
Equate Steerable Knee Walker Scooter,$115.00,4.6/5.0,https://www.walmart.com/ip/Equate-Steerable-Knee-Walker-Scooter/128305573,"For those recovering from a below-the-knee injury or surgery, the Equate Dual Pad Steerable Knee Walker with basket is a simple yet comfortable alternative to crutches. Designed to keep you active and moving, this knee walker scooter features fully maneuverable front wheels. Adjustable to suit the needs of each individual user, it offers tool-free height and leg adjustments, and the two-piece leg pad provides superior comfort. In addition, the deluxe dual-braking system provides maximum safety while the 8&quot; wheels are ideal for indoor or outdoor use.",Game changer vs crutches.  Easy to navigate.  Adjstable. Fits in back seat of car.   Good quality - excellent value.
Roscoe Medical Universal Knee Scooter Pad Cover,$10.53,4.1/5.0,https://www.walmart.com/ip/Roscoe-Medical-Universal-Knee-Scooter-Pad-Cover/46396718,"Stay both comfortable and mobile with the Roscoe Universal Knee Scooter Walker Pad Cover. It's made of 100 percent durable polyester. This walker accessory has a soft, fluffy top to reduce rubbing and chafing on the knees while you use your scooter. An elastic band keeps it securely in place even if you're move around. This polyester cover is sized to fit a variety of knee scooter models. It's machine washable and an easy way to keep your mobility device clean and comfortable.","I bought this pad because I had surgery which requires 'no weight' on my foot. I will be on the scooter for a few months. Although the original scooter seat is relatively comfortable this soft knee rest pad over the seat is soft, allows for sweat free scooting and eliminates the twisting of the knee skin when moving around.  The seat on my scooter is in two parts with a space in the middle for the cast lip. This pad does not hinder this function. This purchase was an excellent investment and I recommend it to those in a similar situation."
Drive Medical DV8 Aluminum Steerable Knee Walker Kne  ...,$146.99,4.6/5.0,https://www.walmart.com/ip/Drive-Medical-DV8-Aluminum-Steerable-Knee-Walker-Knee-Scooter-Crutch-Alternative/15423445,"For patients experiencing pain or discomfort following foot surgery, breaks, sprains or ulcers, the Steerable Knee Walker from Drive is a simple, durable, and comfortable alternative to crutches that allows you to better manage pain and recover more quickly. Crutches can be cumbersome and uncomfortable and their prolonged use can cause painful sores under the arms. The Steerable Knee Walker eliminates those concerns with a smooth rolling option that provides quicker mobility along with four-wheel stability and safety. The fully maneuverable front wheels allow the user to conveniently steer around obstacles and corners for superior ease of use around the home or in busy hallways. The large 8 wheels also make the Walker great for handling outdoor terrain. The deluxe dual-braking system allows quick stopping, ensuring even greater safety. Tool-free height and left/right leg adjustments let users tailor the Knee Walker to their specific needs. Dont wait to experience the enhanced mobility and comfort of the Steerable Knee Walker Experience the Drive Difference Now!",The knee walker is by far easier than crutches or a walker. I had ankle surgery and ended up with a cast up to my knee. No pressure on my right foot was allowed. The scooter glides easily and is small enough to maneuver around doorways and other obstacles. I can easily sit on the cushioned knee rest when the need arises. The price is very reasonable compared to others on the internet. I would highly recommend this to anyone with the use of only one leg.
Drive Medical Dual Pad Steerable Knee Walker Knee Sc  ...,$129.99,4.6/5.0,https://www.walmart.com/ip/Drive-Medical-Dual-Pad-Steerable-Knee-Walker-Knee-Scooter-with-Basket-Alternative-to-Crutches/38444211,"For those experiencing pain or discomfort following foot surgery, breaks, sprains or ulcers, the Dual Pad Steerable Knee Walker with Basket from Drive is a simple, comfortable, durable, and pain-free crutch alternative. Unlike other knee walkers that offer only forward-facing front wheels, Drive's Steerable Knee Walker features a fully maneuverable pair of front wheels for superior ease of use. Plus, the new two-piece leg pad provides superior user comfort. Tool-free height and left/right leg adjustments let users tailor the Knee Walker to their specific needs. The unit's 8&quot; wheels make it ideal for indoor and outdoor use and the deluxe dual braking system helps maximize safety. The Dual Pad Steerable Knee Walker with Basket provides quicker mobility and enhanced safety and stability over crutches allowing you to better manage pain and recover more quickly.",Game changer vs crutches.  Easy to navigate.  Adjstable. Fits in back seat of car.   Good quality - excellent value.
Equate Crutch Pillows,$9.67,4.8/5.0,https://www.walmart.com/ip/Equate-Crutch-Pillows/262120045,"<p>Using crutches can be uncomfortable and even a bit painful at times. These Crutch Pillows provide padding for your hands and under your arms to help you move with comfort. After all, a broken leg or sprained ankle is painful enough. Each pillow is machine washable and made to fit standard underarm crutches.</p> <p>Making the right health decisions can be challenging. With a complete range of products and simple solutions, Equate allows you to take care of your family with confidence.</p>","These pillows definitely help relieve some of the pain of the old style crutch pads under the arms. The hand ones are soft, but seem a little bulky for most people's hands. I have big hands and I was barely able to get my hand around them. Also, there is no instructions included in the box to assist in putting them on. I was able to, but others might have issues trying to figure out how each item went on correctly."
Super Big Foot Cane Tip in Black,$11.06 - $13.18,5.0/5.0,https://www.walmart.com/ip/Super-Big-Foot-Cane-Tip-in-Black/54423195,The Super Big Foot cane tip allows any cane to stand on its own in style! The six &quot;foot&quot; tip will keep your cane where you leave it eliminating the fear of it falling down or you losing it. But don't worry about losing functionality as the will flex when you walk allowing you to stay mobile. Dress up your cane in style with two color options: black and pink. Cane tip can be easily added onto any standard aluminum cane with a 3/4-inch shaft.,working great
"Inspired by Drive Pediatric Forearm Crutches, Pair",$57.74 - $73.33,0.0/5.0,https://www.walmart.com/ip/Inspired-by-Drive-Pediatric-Forearm-Crutches-Pair/952258346,"Our Forearm Crutches provide all the necessary support needed to facilitate standing or walking for your child. We offer three vibrant color selections for your child to choose from: Wizard Purple, Knight Blue and Castle Red.",arrived quickly and in excellent condition
Crutch Accessory Kit,$9.75,2.7/5.0,https://www.walmart.com/ip/Crutch-Accessory-Kit/54423162,"Includes all of the items that you need to rehab your crutches. Each kit includes a pair of crutch arms pads, hand grips and 3/4-inch tips. All accessories are in grey color that will resist wear and tear.",The crutch pads are very thin. If you have to use crutches everyday this is so uncomfortable. The hand grips have some plastic thing in the middle that can not be removed. I don't know what kind of crutches they fit but not mine.
