Stander Walker Replacement Wheels- Set of 2,$15.99,4.7/5.0,https://www.walmart.com/ip/Stander-Walker-Replacement-Wheels-Set-of-2/44374594,These Stander Walker Replacement Wheels are made to roll smoothly over surfaces They are constructed from a tough urethane material for enhanced durability These 6&quot; walker wheels are compatible with both the Stander Fold N Go Walker and the Able Life Space Saver Walker 20 They are designed with bearings to provide smooth and even rotation The center holes provide for a safe and secure installation,Walmart #  553887096
Medline Walker Basket Accessory,$19.25,4.0/5.0,https://www.walmart.com/ip/Medline-Walker-Basket-Accessory/7983662?wpa_bd=&wpa_pg_seller_id=F55CDC31AB754BB68FE0B39041159D63&wpa_ref_id=467a046ca957f75c700a2d913872bcda&wpa_aux_info=__aux_info__&wpa_tag=&wpa_pos=3&wpa_plmt=__plmt__&wpa_aduid=__aduid__,"The Medline walker basket accessory makes it easier to carry important items with you It offers plenty of storage space and can hold up to three pounds This basket for mobility walker attaches easily to any style walker It is made with plasticcoated wire and is convenient to use You can put your groceries in it while you shop instead of struggling with a cart This basket can also hold your purse or bag, making the contents more accessible Put your belongings in this basket to take strain off your shoulders and back Because it detaches easily, you can take it with you anywhere Add this to your collection of walker accessories",Walmart #  552290883
Walker/Wheelchair/Scooter Bag,$12.47,4.8/5.0,https://www.walmart.com/ip/Walker-Wheelchair-Scooter-Bag/33789757,"The Wheelchair and Walker Bag makes it easier for you to carry your important items wherever you go Its easy to set up, just clip it onto the frame, and youre ready to travel This wheelchair bag is available in select colors Its made from 100 percent cotton, making it soft and strong for lasting use This bag is machine washable for easy care and cleaning There are different compartments and pockets so you can use it for organizing your personal items An accordion bottom section expands to up to 3&quot; wide The straps of this bag can also be used for hand carrying",Walmart #  570339901
"Carex Walker Auto Glides, 2 Ct",$7.98,4.3/5.0,https://www.walmart.com/ip/Carex-Walker-Auto-Glides-2-Ct/28933659,Our Auto Walker Glides provide the convenience of a glide with the added safety of an auto brake Simply push down on the walker to activate the brake For use on the back of a wheeled walker Fits most walkers Fits most walkers Easy to use brake for added safety Product Dimensions: 18 x 18 x 3 inches ; 32 ounces,Walmart #  552602071
"Equate Walker Ski Glides, Gray, 1 Pair",$5.74,0.0/5.0,https://www.walmart.com/ip/Equate-Walker-Ski-Glides-Gray-1-Pair/683991050,"Leg injuries can be challenging, but with Equate Walker Ski Glides, you can move around with ease using these with your walker This set contains a pair of ski glides that fits on most walkers and allows walkers to glide easily and smoothly over most surfaces/p /p  Making the right health decisions can be challenging With a complete range of products and simple solutions, Equate allows you to take care of your family with confidence/p",Walmart #  567994772
Guardian Walker Glide Caps - G07904,$7.04,5.0/5.0,https://www.walmart.com/ip/Guardian-Walker-Glide-Caps-G07904/42066562,Allows walkers to easily and quietly glide across most nonabrasive surfaces Fits tips with 15&quot; OD,Walmart #  567204863
"Drive Medical Universal Walker Wheels, 1 Pair",$7.19 - $19.66,4.8/5.0,https://www.walmart.com/ip/Drive-Medical-Universal-Walker-Wheels-1-Pair/17284816,"The Drive Medical Universal Walker Wheels with Rear Glides comes with 5&quot; caster wheels and two sets of rear glides The rubber wheels allow most walkers to roll easily and smoothly over irregular surfaces, and the rear glide caps with covers allow for use on all surface",Walmart #  551172315
Drive Medical Single Fold Portable Wheelchair Scoote  ...,$81.49 - $199.07,4.9/5.0,https://www.walmart.com/ip/Drive-Medical-Single-Fold-Portable-Wheelchair-Scooter-Ramp-with-Carry-Handle-and-Travel-Bag/15423338,"The Wheelchair and Scooter Ramp by Drive Medical is designed for transitioning a wheelchair or scooter from one surface height to another The durable, folding, lightweight construction allows for the ramp to be easily transported in its carry bag This ramp was especially designed with perforated slots to keep water from collecting on the ramp and ensuring users safety while in use This 3 long ramp allows for up to a 6&quot; rise in surface height The ramp has a total weight capacity of 600 lbs",Walmart #  563276093
"Equate Walker Tennis Balls, 2 Ct",$13.19,4.7/5.0,https://www.walmart.com/ip/Equate-Walker-Tennis-Balls-2-Ct/14179100,"Equate Walker Tennis Balls can help you move smoothly throughout your day Walkers are easier to use when the back legs can glide over surfaces without sticking and getting hung up on obstructions Equate Walker Tennis Balls are made to fit right on the walker to help it glide along the surface with ease and prevent scratches or scrapes to your floors They are precut so that you can insert them on the walker legs right out of the pack Whether you are moving forward, backward or navigating around corners, these Equate Walker Tennis Balls will help you along the way/p Making the right health decisions can be challenging With a complete range of products and simple solutions, Equate allows you to take care of your family with confidence/p  /",Walmart #  567820939
"DMI Telescoping Wheelchair Ramp for Home, Portable a  ...",$115.78,4.0/5.0,https://www.walmart.com/ip/DMI-Telescoping-Wheelchair-Ramp-Home-Portable-Lightweight-Wheelchair-Ramp-Handicap-Retractable-Wheelchair-Ramps-Steps-Adjustable-3-5/7079363,"Transport patients to and from appointments with this DMI Portable Wheelchair Ramps Adjustable From 3 to 5 They are made of noncorrosive, lightweight and durable aluminum with nonskid Ushaped tracks for improved safety These telescoping wheelchair ramps adjust from 3 to 5, making them easy to use them on different step sizes and heights see measuring directions They are a handy item to have in your home so wheelchair users can easily come and go from rooms that have steps They are also ideal to have around for visitors if your entrance has a step or curb Plus, wheelchair users will find them invaluable when visiting friends or family who may not have accessible entrances These DMI Portable Wheelchair Ramps, Adjustable From 3 to 5, are lightweight and compact They are easy to travel with or store in the trunk of your car Each ramp weighs 6 lbs, making them easy to lift and position and can support up to 330 lbs 660 lbs total between them  /",Walmart #  004004121
69'' Tri-Fold Aluminum Folding Loading Ramp for ATV   ...,$98.84,0.0/5.0,https://www.walmart.com/ip/69-Tri-Fold-Aluminum-Folding-Loading-Ramp-for-ATV-Motorcycle-Truck-Trailer-Lawnmower-1500lb-Capacity/476766816,b Specifications:/b  /  liMaterials: Aluminum/li  liUnfolded Dimension: 492 x 22 x 69 WxDxH/li  liFolded Dimension: 161 x 67 x 69 WxDxH/li  liHook Size: 35 x 16 x 03 LxWxThickness/li  liMax Load Capacity: 1500 lb/li  liMax Height Limit to Ground Level: 354/li  liGW: 284 lb/li  liColor: Silver/li  /  b Package included:/b  /  li1 x TriFold Aluminum Ramp/li  /  b Please Note:/b  /  liSecure ramp to truck or trailer with safety straps before use/li  liUse ramp on a stable and level surface only/li  liDo not exceed maximum height limit to ground level and the maximum load capacity /li  /,Walmart #  569842001
Able Life Universal Stand Assist,$79.00,4.7/5.0,https://www.walmart.com/ip/Able-Life-Universal-Stand-Assist/39992212,"The Universal Stand Assist by Able Life offers a simple way to stand from any couch, chair, or recliner with greater ease and strength It will fit under or on top of cushions and provides a handle to use to safely rise from or lower to any seated position safely Adjusts in height, depth, and width to fit a wide range of couches and chairs H 22&quot;  32&quot;, D 23&quot;  26&quot;, W 19&quot;  26&quot; Supports 300 lbs",Walmart #  553207706
Mabis Healthcare Foot Stool with Handle,$39.95,4.7/5.0,https://www.walmart.com/ip/Mabis-Healthcare-Foot-Stool-with-Handle/10161108,"Safety While You Step  /When you need to reach something on the top shelf or step up to a higher level such as a bed or vehicle, the DMI Step Stool gives you the height and stability you need Unlike most step stools that provide no place to put your hands, the DMI step stool gives you a convenient handle to use to steady yourself No more losing your balance as you climb to a higher level You will also gain firm footing on the nonslip matting  /  /Get Into Vehicles With Ease  /Do you or one of your family members need a boost when getting into higher profile vehicles like vans, trucks and SUVs? This sturdy stool will make it easier than ever to take that extra step No more worries about elderly relatives or children getting into your car",Walmart #  004028661
"Carex Folding Crutches for Youth, Adult and Tall Use  ...",$35.83,4.0/5.0,https://www.walmart.com/ip/Carex-Folding-Crutches-for-Youth-Adult-and-Tall-Users/33484288,"Get help with your mobility while injured by using the Carex Folding Crutches for Youth, Adult and Tall Users They are designed to quickly fold in half These walking crutches easily fit under a car seat, dining table or even in an overhead bin This way you will not have to feel restricted when trying to do various activities The Carex crutches are made with convenience and portability in mind An injury should not keep you from being able to move from place to place when needed They are designed to be easy to manage and are comfortable with blue sturdy grips and pads The units are lightweight and universally sized They can be quickly adjusted with a simple push of a button to accommodate youth, adult and tall users Anyone from the height of 411&quot; to 64&quot; can use them Use them around the house to get from room to room, or use them when you are out and about",Walmart #  552009817
"Drive Medical Universal Cup Holder, 3"" Wide",$12.47,3.4/5.0,https://www.walmart.com/ip/Drive-Medical-Universal-Cup-Holder-3-Wide/15423438,"Take a refreshing drink with you on your daily jaunts without the worry of spills The universal cup holder affixes firmly to a variety of mobility devices and swivels to keep your drink level The cup holder clamp comes with a removable rubber insert, allowing it to fit on virtually any size tubing This convenient accessory is a great addition to your walker, rollator, wheelchair, or transport chair Easy to install; simply place the ushaped clamp around the pole and thread the tightening screw through the holes Drive Medicals Universal Cup Holder is just what you need to keep a drink with you during your busy day",Walmart #  563285124
"Drive Medical Gel ""E"" Skin Protection Wheelchair Sea  ...",$23.60 - $34.68,4.3/5.0,https://www.walmart.com/ip/Drive-Medical-Gel-E-Skin-Protection-Wheelchair-Seat-Cushion/17284743,"The Gel &quot;E&quot; 3&quot; Wheelchair Cushion with Gel Bladder by Drive Medical is a pressure reducing cushion, designed to assist in the prevention, treatment and management of pressure ulcers The viscous gel bladder provides optimized pressure reduction, support and comfort The polyurethane foam shell is fire retardant and the removable and replaceable cover has a water resistant top, and non slip vinyl base ensuring users safety",Walmart #  551085716
"Carex Upeasy Seat Assist Lifting Seat, Standard Size",$83.76,3.1/5.0,https://www.walmart.com/ip/Carex-Upeasy-Seat-Assist-Lifting-Seat-Standard-Size/25490686,"This Carex Upeasy Seat Assist Lifting Seat is designed for use in or outside the home and will work on most armchairs or sofas, giving you versatility in your use It has a slim size that makes it easy to take with you on the go The uplift seat assist provides up to 70 percent assistance for those weighing up to 220 lbs It has a blue tone that makes it simple to locate when you are ready to sit down This Carex seat lift assist is made with patented Level Lift Technology for reliable lifting performance It is specially built with a hydropneumatic gas spring so you can smoothly stand as needed The selfpowered construction makes it easy to use It has a standard size and does not require any batteries for operation",Walmart #  551556260
"Equate Coccyx Foam Cushion, Black",$19.95,4.8/5.0,https://www.walmart.com/ip/Equate-Coccyx-Foam-Cushion-Black/752434963,"Sitting long hours on a chair, wheelchair or the floor can cause uneasiness and pain on your hips Use Equate Coccyx Foam Cushion to provide support and comfort while seated Inflating the cushion is easy; simply unroll the compressed cushion out of the plastic bag, and allow it to decompress to full size in 12 hours The ergonomic cutout and tilted shape reduces pressure on the spine and the coccyx tailbone post injuries, surgeries or during day to day use It is ideal for home or office use and travel Get relief from back pain by replacing hard and ordinarily cushioned surfaces with Equate Coccyx Foam Cushion/p Making the right health decisions can be challenging With a complete range of products and simple solutions, Equate allows you to take care of your family with confidence/p  /",Walmart #  570396889
"DMI Wheelchair Cushion for Pressure Sore Relief, Sea  ...",$28.19,3.3/5.0,https://www.walmart.com/ip/DMI-Wheelchair-Cushion-for-Pressure-Sore-Relief-Seat-Cushion-for-Wheelchair-Comfort-Pillow-Cushion-for-Seniors-and-Elderly-Plaid/36782225,"This DMI Comfort Pillow Cushion is the ideal choice for making your wheelchair, recliner or another piece of furniture more comfortable It comes equipped with six straps that hold it in place without allowing the pad to slip or slide down The wheelchair cushion contours to the shape of the body to protect the user from sustaining painful pressure sores Its machine washable to easily remove stains and keep the fabric looking its best This plaid cushion features highly absorbent and hypoallergenic polyester fiberfill Its supportive and promotes healthy posture The DMI Comfort Pillow Cushion is made from durable material to prevent sharp objects or instruments from tearing and ripping the surface",Walmart #  552690340
DMI Donut Seat Cushion Pillow for Tailbone Pain and   ...,$19.21,3.6/5.0,https://www.walmart.com/ip/DMI-Donut-Seat-Cushion-Pillow-Tailbone-Pain-Hemmorhoids-18-inch-Pregnancy-Donut-Sitting-Pillow-Therapeutic-Molded-Foam-Ring-Donut-Pillow-Navy/22440458,DMI FM INVLD CSHN WRP,Walmart #  563271103
Roscoe Medical Universal Knee Scooter Pad Cover,$10.53,4.1/5.0,https://www.walmart.com/ip/Roscoe-Medical-Universal-Knee-Scooter-Pad-Cover/46396718,"Stay both comfortable and mobile with the Roscoe Universal Knee Scooter Walker Pad Cover Its made of 100 percent durable polyester This walker accessory has a soft, fluffy top to reduce rubbing and chafing on the knees while you use your scooter An elastic band keeps it securely in place even if youre move around This polyester cover is sized to fit a variety of knee scooter models Its machine washable and an easy way to keep your mobility device clean and comfortable",Walmart #  554405337
Stander Lever Extender - Oversized Handle for Easy C  ...,$19.00,4.6/5.0,https://www.walmart.com/ip/Stander-Lever-Extender-Oversized-Handle-for-Easy-Chair-Recliner-Handles/39798110,"Make it easier to recline in your favorite chair by adding this Stander Lever Extender The unit provides a solid gripping surface to your chair handle Use it to prevent strain each time you want to sit back and relax This recliner handle extension provides you with more surface to grasp Its constructed out of heavyduty steel but weighs only 1 lb This recliner part features a fourbolt attachment that ensures a secure fit to most handles The device is also helpful for people who are recovering from surgery, suffering from arthritis or pregnant Your favorite chair will become even more enjoyable for you to sit in This part comes in a black color, so it can easily pair with your recliners color You will be able to quickly and easily attach it as well as remove it when the time comes",Walmart #  553189085
"Carex Upeasy Seat Assist Lifting Seat, Plus Size",$78.30,3.8/5.0,https://www.walmart.com/ip/Carex-Upeasy-Seat-Assist-Lifting-Seat-Plus-Size/25490688,"Provide relief for the back, legs and knees when you use this Carex Upeasy Seat Assist Lifting Seat on almost any type of chair or sofa The device requires no batteries or electricity, so it is easily portable The plussize uplift seat assist is selfpowered and is capable of achieving up to 70 percent of the lift assistance that is required to stand Patented spring technology allows the user the help that is needed, and it provides a comfortable cushion to sit on Use this Carex lifting seat at home, at a restaurant and more Each seat can hold up to 340 lbs",Walmart #  551556266
"Equate Bedside Rail, Black",$38.88,4.6/5.0,https://www.walmart.com/ip/Equate-Bedside-Rail-Black/14179103,"Simple daily activities like getting in and out of your bed can become difficult with old age or after an injury Equate Bedside Rail helps you eases your movement in and out of bed with safety and security It can be assembled without tools, and height adjusted by inch increments from 32&quot; to 44&quot; It accommodates most twin, queen or king sized beds Designed to provide maximum balance and stability, the sturdy frame can support weights of up to 300 lbs It has a foam grip for comfortable gripping, and a strap for securing it to the bedframe The skidresistant rubber tips on legs provide additional traction Experience ease and comfort in your daily life with Equate Bedside Rail/p Making the right health decisions can be challenging With a complete range of products and simple solutions, Equate allows you to take care of your family with confidence/p  /",Walmart #  567994760
