"Drive Medical Scout Compact Travel Power Scooter, 4   ...",$768.90 - $799.00,4.3/5.0,https://www.walmart.com/ip/Drive-Medical-Scout-Compact-Travel-Power-Scooter-4-Wheel/33651307,"The Scout transportable scooter combines easy and convenient mobility with superior value. The Scout is compact, lightweight and easy to disassemble-perfect for taking wherever you want to go, either around the neighborhood or far from home. It can be disassembled quickly and easily into five easy-to-handle pieces for loading into a car, truck, or van and taking shopping or on vacation. The four-wheel version of the Scout allows for enhanced stability on rougher outdoor terrain. The Scout also offers great features like a quick connect battery pack and a delta-style tiller to make operating the scooter easier for those with limited strength or dexterity. This model comes with color-through panels to hide scuffs and scratches and black wheel rims.","The only regret I have in buying this scooter is the fact I didn't get it sooner. It was very easy to put together and adjust to my size. I'm 5'8, 195 pounds and I don't find it small or confining as others have stated. I received the smaller batteries and already have found them to be more than adequate for my needs. Other companies charge twice the price and their batteries are rated for less distance than this one. I have yet to discharge the battery more than 1/4 capacity. The gauge has never fallen below the second green light. Yes, it has plastic wheels so you will feel a slight jarring when going over uneven pavement (the same as those free scooters at supermarkets), but the upside is that you don't have to watch tire pressure for inflatible tires; these should last a long time. The seat is comfortable. I went from early morning to late afternoon at a large two story mall and had no aches or pains. I cannot use the highest speed as those walking with me have said they can't keep up with me at high speed. I've taken it up steep ramps from an underground parking garage at a hospital with no problems. You do have to be careful when making sharp turns. No four wheel scooter is going to have the small turning radius as a three wheeler, but the stability more than makes up for this minor inconvenience. All in all, I would not hesitate to recommend this Drive scooter."
Roscoe Medical Knee Walker Scooter with Basket and P  ...,$143.00 - $179.00,4.1/5.0,https://www.walmart.com/ip/Roscoe-Medical-Knee-Walker-Scooter-with-Basket-and-Padded-Seat-Black/30329307,Retain your independence while recovering with this Black Roscoe Medical Knee Walker/Scooter. It's ideal for patients who are undergoing physical therapy and are working towards getting back on their feet. This walker with wheels provides comfort and ease of mobility. It has a padded knee platform and adjustable hand brakes with grips for comfort and full control. It also includes large 8&quot; clear PU wheels with sealed bearings. This Black Roscoe Medical Knee Walker/Scooter is suitable for indoor and outdoor use. It has an easy folding mechanism that collapses using a thumb release lever and it fits underneath the raised knee platform for convenient storing and transporting. This walker with wheels can support of to 350 lbs. It also has an offset post located on the knee platform that enables you to make right-to-left adjustment without the need for tools.,"I ordered my scooter on Tuesday in hopes of getting it before the weekend. To my surprise I received it on Friday morning 2 days before the expected delivery date. This scooter is well made, in fact better than the one I rented from the medical supply store. The cost of the scooter was the same price as renting one for 1 week! I saved over $500.00 that I would have paid in rental fees and a $200.00 deposit. THANK YOU WALMART! The flowers are my extra touch."
Drive Medical Bobcat X3 Compact Transportable Power   ...,$579.00,3.9/5.0,https://www.walmart.com/ip/Drive-Medical-Bobcat-X3-Compact-Transportable-Power-Mobility-Scooter-3-Wheel-Red/38445318,"Drive's latest lightweight transportable scooter is a heavyweight when it comes to comfort, performance, and value. The new Bobcat X is the perfect entry-level scooter providing mobility that is comfortable, reliable, and affordable. The ultra-lightweight Bobcat X also boasts a wealth of features that take it a step beyond basic transportation.",My wife loves it.  It is lightweight enough that I only need to remove the seat and basket to fit it into the trunk of my Elantra.  It will come much further apart for those who do not possess enough u[[er body strength to lift it the way I do.  The price was fantastic!  Lowest priced scooter I could find on the market adequate enough to do the job (plus it will haul my 270 lb carcass).
"Shoprider Echo 3 Wheel Scooter, Blue, 70 Pound",$599.00,4.0/5.0,https://www.walmart.com/ip/Shoprider-Echo-3-Wheel-Scooter-Blue-70-Pound/30257726,,I like it but it could use a little more leg room!
"Drive Medical Scout Compact Travel Power Scooter, 3   ...",$679.00 - $779.00,4.7/5.0,https://www.walmart.com/ip/Drive-Medical-Scout-Compact-Travel-Power-Scooter-3-Wheel/33651302,"The Scout transportable scooter combines easy and convenient mobility with superior value. The Scout is compact, lightweight and easy to disassemble-perfect for taking wherever you want to go, either around the neighborhood or far from home. It can be disassembled quickly and easily into five easy-to-handle pieces for loading into a car, truck, or van and taking shopping or on vacation. The three-wheel version of the Scout allows for nimbly negotiating indoor obstacles. The Scout also offers great features like a quick connect battery pack and a delta-style tiller to make operating the scooter easier for those with limited strength or dexterity. This model comes with color-through panels to hide scuffs and scratches and black wheel rims.","I lost ability to walk a yr ago but had 7 yrs of previous issues and have you used walkers canes rollators &  wheelchairs. I slowly saw my active life going downhill and being stuck in the house with no normal life.  Insurance doesnt cover mobility scooters if you need outside the house mainly even if you have a lot of doctors appointments on a regular basis like myself. I did my research for over a month checking out other companies and units. Because paying out-of-pocket this was most reasonable even on a low budget. This model is normally over $900 to $1,700. From medical supplies companies. At first I thought there was something wrong with the pricing. But I called Drive Medical to make sure there wasnt a catch, that they are official equipment. The rep was amazed that the price was half the amount the medical supplies stores and providers have them for. But these come direct from Drive Medical. No going to the medical place or doctors to get it which saves you & your insurance. This is your item you own this. When going through Insurance it is only rented is not technically yours until i beleive mth 15. 

I put the scooter together myself it took a little longer than the two minutes due to being handicapped obviously. It was very easy besides tightening the seat nut and bolt. I had to find tool for that was just right. The only downfall was they didn't say you had to flip a knob on the front to get the wheels unlocked in the manual which is not Walmart's fault.

I took it for a test ride down to the shopping center 1.6 miles from my house it took me about 28 minutes because I had 3 main street lights to cross and a little down hill incline. Which the scooter handled well it would not handle much more of an incline going up. Which they do state limits for inclined. Went to a grocery store & a discount store which I was in about an hour going up and down the aisles. I was driving the scooter about 2 hours total before it was down to red lights. I did turn the power off while waiting at the stop lights as well as waiting in line at the grocery store I'm not sure if that would have wore the battery down more or if it helps but I was just trying it out. Lol the basket holds a decent amount of stuff and I also could put groceries on the floor. 

The fact that it's compatible it's perfect for trips I'll be taking it when I go to Niagara Falls verse rent one period when flying or taking a bus the luggage can go on the floor of the scooter so its better then a rolator or wheelchair. Is very handi. It charged very fast to the full power I want to say it took a few hours. But that's not bad since it went to fully powered.  I use a pillow for added comfort & height. 

The Paratransit busses have room for these and now I am able to get out of the house and do normal people activities which I couldn't do before I got this. I would struggle using a rollator in a wheelchair. A very good investment. Now I just need to either learn the hand signals or find signals to put on the back seat & basket. Lol  I will be buying the little light to put on the basket for night time. 

Drive Medical said they do cover the warranty just have to call them with the units number. I just don't know where to find that since it's not with the paper or in manual."
Silver Spring SC400-V2 Hitch Power Scooter Wheelchai  ...,$205.99,4.6/5.0,https://www.walmart.com/ip/Silver-Spring-SC400-V2-Hitch-Power-Scooter-Wheelchair-Carrier-Rack/29389754,"Discount Ramps improved version and next generation V2 power scooter hitch-mounted medical wheelchair carrier rack featuring innovative ramp connector brackets, integrated carrying handles, improved visibility, and makes it conveniently easy to transport a mobility scooter. A quick, simple, safe, and affordable means for transporting scooters or wheelchairs with a vehicle hitch. Loading ramp measures 42&quot; long x 27.5&quot; wide. The platform measures 46.5&quot; long x 28&quot; wide, providing enough space for most of today\'s mobility devices; 3.125&quot; high side rails feature 11 different tie down points for securing the power wheelchair or scooter to the rack. Folds up when not in use, and with a 400 lb. capacity, the SC400-V2 can quickly attach to most 2&quot; Class III or IV hitch receivers. Manufactured by Discount Ramps IC 042. US 100 101 Trademark 4,192,958 - SC400-V2 Specifications: Center of 5/8&quot; Hitch Pin Hole to Carrier - 7&quot; folded, 14.75&quot; unfolded. Center of 5/8&quot; Hitch Pin Hole to Back of Carrier 14.5&quot; folded, 44-7/8&quot; unfolded. 11-14&quot; Hitch Height. 27&quot; Maximum scooter or wheelchair width. Most Class III hitches are rated for 500 lbs. Most Class IV hitches are rated for 1000 lbs. Vehicle Hauling Capacity: Your hauling weight may be limited by your vehicle\'s capacity to carry a load. Will not work with class II or smaller receivers. Some vehicles may require air shocks or heavier springs to stiffen up the suspension to prevent sagging. Please check with your dealer to find out if your vehicle\'s carrying capacity. For safety, do not use the SC400-V2 hitch carrier with tow-behind trailers including 5th wheel trailers and camping trailers or with hitch adapters and extensions. Large platform with multiple tie-down points to secure a power scooter or cargo Easy to use integrated loading ramp locks into place with (2) spring pull pins Designed for safe and stable use with 2&quot; Class III or IV hitch receivers Heavy duty black paint coat steel construction with a reinforced mesh deck and Discount Ramps Logo on the tray Manufactured by Discount Ramps IC 042. US 100 101 Trademark 4,192,958","This rap works well, was not bad to assemble, but the assembly instructions are incomplete.  About three steps are omitted, any one with some mechanical ability can overcome this easily."
4 Wheel Heavy Duty 500lbs. Wt. Capacity Scooter with  ...,"$2,999.00",5.0/5.0,https://www.walmart.com/ip/4-Wheel-Heavy-Duty-500lbs-Wt-Capacity-Scooter-with-Electromagnetic-Brakes-Red-EWHEELS/45010939,,"I lost my drivers license this year and my new scooter basically has become my car. I have to rely on this scooter for my main transportation for both errands and visiting friends. I can honestly say that this scooter has met everyone of my expectations !

I recommend this scooter to everyone that ask me about it. I love it ! This scooter has given me my freedom back."
Drive Medical Spitfire DST 4-Wheel Travel Scooter,"$1,249.00",3.8/5.0,https://www.walmart.com/ip/Drive-Medical-Spitfire-DST-4-Wheel-Travel-Scooter/652023602,"The Spitfire DST (Dynamic Suspension Technology) transportable scooter combines easy and convenient mobility with the most comfortable ride possible. The Spitfire DST is compact, lightweight and easy to disassemble; perfect for taking wherever you want to go, either around the neighborhood or far from home. It can be disassembled quickly and easily into five easy-to-handle pieces for loading into a car, truck, or van and taking shopping or on vacation. The four-wheel Spitfire DST allows for enhanced stability on rougher outdoor terrain. Equipped with Dynamic Suspension Technology on the front and rear of the scooter for the smoothest most comfortable ride possible. The Spitfire DST also offers great features like a quick connect battery pack and a delta-style tiller to make operating the scooter easier for those with limited strength or dexterity. This model comes with high gloss color panels, metallic wheel rims, and a stadium style seat.","Look at the bottom of the tiller. Just below the light. You will see a knob. It's over like in shape and reads unlock. That unlocks the front wheels (see photo) and man on man this thing will turn on a dime now and give you 4 cents change. Just watch your speed when turning. 

I weigh 260, and I'm 6ft tall. I have lots of leg room and power. My seat is at the highest setting. I bought 2 of these from Walmart. (best price, but same as Amazon). I have drop foot and my wife has a curved spine. We are RVers and have given up so much because  we can't walk very far. With these, the world is ours again. What I really love, is they fit in the back seat of our truck when broken down. LOVE THIS SCOOTER."
E-Wheels - EW-66 - 2-Passenger Heavy Duty Scooter -   ...,"$3,249.00",5.0/5.0,https://www.walmart.com/ip/E-Wheels-EW-66-2-Passenger-Heavy-Duty-Scooter-3-Wheel-Red/45948507,"E-Wheels - EW-66 - 2-Passenger Heavy Duty Scooter - 3-Wheel - Red, Weight Capacity: 600 Lbs., Weight: 265 Lbs.",Ewheelsscooter
E-Wheels EW-36 3-Wheel Electric Senior Mobility Scoo  ...,"$2,249.00",5.0/5.0,https://www.walmart.com/ip/E-Wheels-EW-36-3-Wheel-Electric-Senior-Mobility-Scooter-Silver/131593668,"This E-Wheels EW-36 Electric Mobility Scooter is a sleek, safe and affordable electric mobility scooter for seniors designed for both fun and transportation. The item also ships fully assembled for even more added convenience. This 3-wheel mobility scooter uses a transaxle brushless electric motor. At full power, it can reach speeds of up to 18 miles per hour, which makes it easily the fastest mobility scooter on the market. With this senior mobility scooter, you will get up to 45 miles in range on a single charge. Features include a reverse switch, an armrest and large storage basket.","My friend purchased this same scooter last year and I decided to buy one this Spring to enjoy the outdoors and travel through my neighborhood. The scooter arrived last week and I am so so excited! I feel like I have my freedom back, this scooter is fast and I can travel long distances. The other day I visited my Daughter who lives 8 miles away, I was able to ride my scooter on the city parkway and it was so exciting. I stopped at the market on the way home for groceries, I just turned my speed dial to low and drove my scooter right in to the market.

I highly recommend this scooter to anyone looking for a wonderful experience"
Drive Medical ZooMe Three Wheel Recreational Power S  ...,$673.83,4.0/5.0,https://www.walmart.com/ip/Drive-Medical-ZooMe-Three-Wheel-Recreational-Power-Scooter/55149344,"The ZooMe 3 is a modern recreational electric scooter providing personal transportation for everyone! The comfortable extra-wide seat is removable, so you can stand up or sit down while riding it making it great for recreational or mobility use. The ZooMe 3 comes with a powerful 350 watt brushless hub motor providing a top speed of 15 mph, and a maximum range of 17 miles on a full charge.",I have problems with standing and walking and so I'm in the house all the time. Only going to store that have mobile chairs. I'm also raising a granddaughter and I don't get out with her. But since I purchased the ZooMe3 I'm able to go any store and now I get out with the grandbaby and I ride while she skates. It's simply wonderful.
"Drive Medical Phoenix Heavy Duty Power Scooter, 4 Wh  ...","$1,199.00",4.4/5.0,https://www.walmart.com/ip/Drive-Medical-Phoenix-Heavy-Duty-Power-Scooter-4-Wheel/33651321,"If you're seeking an easy, transportable mobility option that's ideal for outdoor use, but need a weight capacity greater than 300 pounds, the Drive Medical Phoenix HD 4 is perfect for you. The Phoenix HD 4 has the highest weight capacity in the market for travel scooters and combines easy portability with a 350 lb. weight capacity to accommodate a greater variety of users. The Phoenix HD 4 is lightweight and easy to disassemble-perfect for taking wherever you want to go, either around the neighborhood or far from home. The scooter can be disassembled quickly and easily into four easy-to-handle pieces for loading into a car, truck or van to take shopping or on vacation. The Phoenix HD 4 offers great features which include color change panels in red and blue and ergonomic &quot;finger-pull&quot; throttle control to make operating the scooter easier if you experience limited strength or dexterity in your hands. The Phoenix HD 4 also includes a headlight for enhanced safety and solid, flat-free tires for worry-free use. You can adjust the height of the Phoenix HD's comfortable stadium-style seat which has attractive two-tone upholstery and armrests that can be adjusted in width and angle. The Phoenix HD also provides top performance with its 4 mph top speed and 15 mile maximum cruising range. Go ahead, experience the Drive difference.","I really   like this scooter, it's been a lifesaver for me when I have to ""walk"" distances (which I am unable to do.)  It fits easily into the back of my SUV without taking apart, I just have to fold the seat down for visibility out the back window.  I would have given it 5 stars, but it needs to be just a little longer to allow for more foot room.  When my feet are on the floorboard they are cramped and my knees are also very cramped.  I try to put my feet on the wheel covers, but that is not always comfortable either, especially on rough ground. So, the price is great, the unit is great, and I am happy for the most part."
EV Rider TRANSPORT Automatic Folding Mobility Scoote  ...,"$1,995.00",4.0/5.0,https://www.walmart.com/ip/EV-Rider-TRANSPORT-Automatic-Folding-Mobility-Scooter-Red/943241600,"The EV Rider Automatic Folding Mobility Scooter automatically folds up in seconds with a handheld remote. It's approved for airline travel and is equipped with an 8.7Ah lithium battery. It weighs 44 lbs, making it ideal for vacations, trains and cruise ships. It features an ultra-tight turning radius and is maneuverable in narrow spaces. This transport mobility scooter has a height-adjustable tiller, LED headlight and a dual-hand two-way throttle control. It has a range of 6.8 miles and reaches a maximum speed of 3.8 miles per hour. It has a rear caster and is an anti-tipper. It fits in the trunk of most cars easily and can be stored virtually anywhere. Limited mobility should not stop you from going the places you want to go and living your lifestyle to the fullest. The EV Rider Automatic Folding Mobility Scooter is easy to use. Simply press the button and watch this innovative ride unfold.","It wonderful that it folds up easily and fits in a trunk or back of car.  Very easy to lift by yourself.  What I do not like is I bought it for the theme parks and the charge does not last throughout the day . For the money it cost, the battery life should last alot longer"
"Drive Medical Ventura Power Mobility Scooter, 4 Whee  ...","$1,699.00 - $1,924.00",5.0/5.0,https://www.walmart.com/ip/Drive-Medical-Ventura-Power-Mobility-Scooter-4-Wheel/33651314,"The Drive Medical Ventura 4 scooter offers a great combination of performance, size, comfort and styling, making it the perfect mobility option if you're looking for the &quot;next step up&quot; from a compact/transportable scooter which includes a 400 lb. weight capacity. The Ventura 4 performs well both indoors and outdoors. This Deluxe model features 36AH batteries for greater range, a full safety package which includes rear view mirrors, additional lighting, and a 20&quot; wide Captain's Seat. You can even customize the Ventura's color with the red and blue interchangeable panels. All Ventura models have four different seat height adjustments and automobile-style seat positioning which slides for forward or backward providing even more comfort. The padded armrests are height, width and angle adjustable. Controlling the Ventura cannot be easier thanks to the adjustable angle tiller that allows you to place the controls in the most comfortable position and the ergonomic delta handles which make it easier for those with limited strength or dexterity to operate the scooter. Go ahead, experience the Drive difference.",My scooter came in almost a week early!  Rides very smooth. Only issue I have is that it sounds like I have a brake on even though I dont. There is a squeaking noise when I ride on it...
Luggie Classic Foldable Power Mobility Scooter - Red,"$1,699.00",5.0/5.0,https://www.walmart.com/ip/Luggie-Classic-Foldable-Power-Mobility-Scooter-Red/47425479,<p></p>,"This is a very nice design scooter and very helpful for mobility needs. Easy to fold and easy to storage. Strong and durable, and it scooters longer as it states. I can travel it with me to outside of country. Strongly recommend it for travelers."
Zip'r Roo 4-Wheel Travel Mobility Scooter,$744.00,0.0/5.0,https://www.walmart.com/ip/Zip-r-Roo-4-Wheel-Travel-Mobility-Scooter/116601460,"<p>Zipr Mobilitys Zipr Roo 4-Wheel Scooter provides you with basic, entry-level assistance with your mobility while keeping your budget in mind. This compact travel scooter is great for users who weigh up to 250 pounds and are under 5 ft 10 in. The Zipr Roo 4-Wheel can travel up to 3.5 miles-per-hour and just over 8.5 miles in distance per charge.</p> <p>The Zipr Roo 4-Wheel disassembles into four lightweight pieces, allowing you to conveniently store it in your trunk when out and about. The compact travel scooter features a small foam seat, removable armrests, an intelligent braking system and aluminum wheels. The Zipr Roo 4-Wheel is ideal for those with a smaller stature and who only need the scooter part-time. Economically priced and designed, the Ziprr Roo 4-Wheel is a great basic, entry-level scooter.</p> <p><b>Features</b></p> <li>Foldable, foam-filled seat rotates 360 degrees</li> <li>Removable, flip-up armrests</li> <li>Disassembles into four pieces</li> <li>Top Speed: 3.50 mph</li> <li>Drive Range: 8.70 miles</li> <li>Heaviest Piece: 32.5 lbs.</li> <li>Weight capacity: 250 lbs.</li> <li> Weight: 105 lbs.</li>",Not made in U.S. And there is no help if something goes wrong and you want to make repair yourself. Could not get wire  layout from place of purchase or manufacture  in Japan to help.
Drive Medical Maverick Executive Three Wheel Power S  ...,"$4,059.98",5.0/5.0,https://www.walmart.com/ip/Drive-Medical-Maverick-Executive-Three-Wheel-Power-Scooter/43224560,"The Maverick was born to be wild! Experience the thrill of the open road with its distinctive appearance which echoes the classic look of a motorcycle cruiser. From its unique look to class-leading performance, we pulled out all the stops to create a new class of scooter design. The Maverick boasts a one of a kind, motorcycle inspired design and incorporates cutting edge technological advancements to provide the most attractive, highest performance scooter available. In addition, the Maverick provides maximum comfort with a smooth, stable ride and a deluxe Captain's Seat.","I have had two scooters before this and this outclasses them all in power, looks and function. It's a serious scooter for those who are frequent outside travellers. 10 out of 10"
Best Choice Products Mobility Carrier Wheelchair Ele  ...,$164.99,4.2/5.0,https://www.walmart.com/ip/Best-Choice-Products-Mobility-Carrier-Wheelchair-Electric-Scooter-Rack-Hitch-Disability-Medical-Ramp/38023636,,"I have never used any type of hitch equipment, so impressed thus far. I have one question involving the hitch bar as it goes into hitch on my p/up truck. Do I need to get a pin that goes thru the matching hole in the hitch and hitch bar of carrier?"
