Drive Medical Lightweight Black Transport Wheelchair,$117.82,4.6/5.0,https://www.walmart.com/ip/Drive-Medical-Lightweight-Black-Transport-Wheelchair/15423388,"The Drive Medical Lightweight Black Transport Wheelchair makes it easier for you to get around despite mobility issues. It has an aluminum frame that makes it strong, reduces bulk and is immune to rust. This Drive Medical wheelchair features a seat belt to keep you secure as you go about. Nylon fabric upholstery resists stains and is soft and comfortable to the touch. Its 8&quot; wheels are made from composite material to be strong and rugged. The footrests swing away to make it easier for you to stand. Padding on the armrests prevents strain from extended use. This wheelchair folds up when you're done with it to make it easier to store away for later. At just 19 lbs it's easy to push or wheel around.","I carefully and thoroughly reviewed the lightweight transport wheelchair options and when the slightly lighter weight wheelchair (14 lbs) was sold out at Walmart, I decided to purchase this 19 lb wheelchair that they sold. I have used it only once, but so far, I am extremely satisfied with it. It is extremely easy to lift and easy to place either in the trunk or body of a car compared to the regular wheelchair I was using. I was also very pleased with the ease of pushing it on pavement as well as in stores. It was a wise purchase and so much easier to use compared to a regular wheelchair.

The one complaint I had was an odor that existed in the box in which the wheelchair was sent. At first, I was concerned that the odor was associated with the fabric of the wheelchair, However, once the wheelchair was removed from the box, the odor has gradually dissipated.

Overall, I am extremely pleased with this purchase and highly recommend it."
Medline K1 Basic Extra-Wide Wheelchairs with Elevati  ...,$142.49,4.0/5.0,https://www.walmart.com/ip/Medline-K1-Basic-Extra-Wide-Wheelchairs-with-Elevating-Legrests/41494521,"The Medline K1 Basic Extra-Wide Wheelchair with Elevating Legrests is designed to deliver quality, comfort and versatility. It has a durable, tig-welded frame with a silver-vein finish that adds its strength. This home health care product boasts a comfortable nylon upholstery that you can sit on for hours. The extra-wide wheelchair has a seat width of 20&quot; and a depth of 16&quot; to fit most people. You can raise and lower the seat up to 2&quot; via the height-adjustable axles. This lightweight, heavy-duty wheelchair has smooth-rolling, solid flat-free tires that can help you glide along any surface with ease. The Medline K1 Basic Extra-Wide Wheelchair with Elevating Legrests has a weight capacity of 300 lbs, desk length removable arms and detachable elevating leg rests for added convenience.","It is very good for the price and I would recommend it for a back up wheelchair. I cut my leg on one of the exposed screws, not good since I'm a diabetic."
Drive Medical Cruiser X4 Lightweight Dual Axle Wheel  ...,$214.35 - $216.99,3.9/5.0,https://www.walmart.com/ip/Drive-Medical-Cruiser-X4-Lightweight-Dual-Axle-Wheelchair-with-Adjustable-Detachable-Full-Arms-Elevating-Leg-Rests/146306124,"Don't let mobility challenges keep you from getting out and experiencing all life has to offer. For many people, a manual wheelchair is the ideal solution to maintaining mobility independence. Manual wheelchairs are among the most commonly used mobility devices thanks to their versatility, functionality, ease of transport and low maintenance. The Cruiser X4 from Drive Medical offers all these features and much more. The Cruiser X4 is ultra-lightweight, yet extremely strong thanks to its aluminum and carbon steel frame which is specially designed to allow for custom seat backs and accessories and includes our patented adjustable-depth seat. The rear wheels can be quickly and easily moved between three separate axles to adjust the seat to the ideal height for the user or to angle the seat back. Other comfort adjustments include armrest height, seat back height and the height and angle of the front caster wheels - all allowing you to tailor the Cruiser X4 to your specific needs. The Cruiser X4 also offers push-to-lock wheel locks to make locking the rear wheels easy - even for those with less hand strength. The Cruiser X4 is available with adjustable height detachable full arms and elevating leg rests (ELRs), which are a necessity if you suffer from a condition such as edema, phlebitis, varicose veins or just tired legs.","This Wheelchair is perfect for my 5'11"" husband. Plenty of room, easy to use. Folds nicely. Lighter weight. A little heavy for me to lift into car but not too bad. Appears to be around 37 lbs or less.  This is a 20"" seat. I ordered the 16"" seat & had to return it, too small. He can even put his legs up if needed with the leg oads. Foot rests & arms are removable. Great value. Well made. Came already assembled."
Drive Medical Rebel Lightweight Wheelchair,$151.99,4.1/5.0,https://www.walmart.com/ip/Drive-Medical-Rebel-Lightweight-Wheelchair/21864724,"The Rebel Lightweight Wheelchair by Drive Medical is the perfect solution for those looking for a very portable and high strength wheelchair in one convenient box. The unit comes standard with quick release rear wheels which allows you to easily remove the large wheels on the back to fit tighter storing places. The Rebel Lightweight Wheelchair's back and frame are also foldable to fit almost any trunk and the swing away footrests are easily removed for convenient storage. The arm rests flip up to make transferring easy, fast and safer. The Rebel Wheelchair is lightweight and very maneuverable making it extremely easy to turn in even the tightest areas. All of this and more makes the Rebel one of the best solutions for people who are always on the go and need a wheelchair.","This wheelchair is sturdy but not real heavy to deal with. It came fully assembled except for the wheels, which went on easily. It's comfortable to sit in, and the nylon fabric cleans easily with a damp sponge. The only negative about the info shown in the website is that it does not tell what the weight capacity is. For those who might read this review, the weight capacity is 300 lbs. I would recommend this chair to others."
Drive Medical Silver Sport Reclining Wheelchair with  ...,$309.97 - $318.99,3.2/5.0,https://www.walmart.com/ip/Drive-Medical-Silver-Sport-Reclining-Wheelchair-with-Elevating-Leg-Rests-Detachable-Desk-Arms/15423453,"The Silver Sport 20&quot; Full Reclining Wheelchair by Drive Medical has a new, state of the art, hydraulic reclining mechanism that allows for infinite adjustments up to 180 degrees. The arms have support extensions while in the reclining position, and the headrest extension, with cushioned head immobilizer, provides stability and comfort. The carbon steel frame, with an attractive silver vein finish, and the durable nylon upholstery make this reclining wheelchair easy to maintain, durable and lightweight. The standard anti-tippers along with the composite Mag-style wheels are set back on the frame to prevent tipping, ensuring user safety. Comes standard with padded armrests, swing away elevating leg rests, plastic footplates, rear anti tippers, 8&quot; front caster wheels for a smooth ride over most surfaces and push to lock wheel locks.",If you have long legs. Don't buy this chair.  Leg rest do NOT extend far enough for me. If you are chunky.  Seat is NOT very wide.  Recline is not worth the extra money. Have to reach behind seat to recline chair. I do NOT recommend this chair unless you are skinny and a short person.
"Karman LT-980 24 pounds Lightweight Wheelchair, 18""   ...",$333.96,4.0/5.0,https://www.walmart.com/ip/Karman-LT-980-24-pounds-Lightweight-Wheelchair-18-seat-Burgundy/35494745,"The Karman LT-980 Wheelchair, 24 Lbs provides a comfortable, supportive ride. This item has a large seat suitable for most users. It is light enough to take with you on trips or use at home comfortably. The Karman lightweight wheelchair in burgundy uses quality aluminum bending during manufacturing to create a strong seat that will last for many uses. It only weighs 24 lbs and can be used every day. It is ideal to ride in when going to the grocery store or staying in your living room. The chair is not too wide to pass through many of the aisles. The Karman ultra lightweight wheelchair 18&quot; seat features a removable footrest to individualize it to your needs. With the footrests removed, foot propellers help you maneuver in multiple terrains. The standard, coupled folding backrest is comfortable for those needing the support.",I am not totally sure about this chair yet...it wheels well but the wheel lock handles have ridges on them and it is cutting up my palms...I had to put something on them...and they are very hard to lock...still not sure if I will keep this chair...it is too bad...just a bad area...
