Drive Medical Deluxe Lightweight Aluminum Transport   ...,$127.99,4.8/5.0,https://www.walmart.com/ip/Drive-Medical-Deluxe-Lightweight-Aluminum-Transport-Wheelchair-Aluminum-Red/15423390,"A Trailblazer in Mobility Support and Independence When it comes to the world of superior wheeled mobility, nothing can beat Drive Medical's leading edge and very popular, sturdy yet Lightweight Transport Wheelchair. This all-purpose wheelchair will empower you like nothing else, as it meets and exceeds your mobile needs and expectations. As a maintenance free Lightweight Transport Wheelchair, this personal transport aid arrives at your door ready to roll. Developed with your comfort, safety and ease of use squarely in mind, it's a durable mobility assistant suited to the unique requirements of men and women, as well as younger users of all ages. In addition to the unbeatable comfort and long-lasting design, it can be folded up in a jiffy and its ultra-lightweight frame makes it easy to move it in and out of any vehicle in no time flat. Due to its sturdy, yet lightweight frame and easy maneuverability, your caregiver will also be singing its praises in no time flat. Available with a 17-inch or 19-inch width seat and in colors Red, Black, Silver, or Blue. Go ahead...Experience the Drive Difference Now! <br /> <br /> <ul>  <li>Aluminum casted back-release hinge allows back to fold down for easy storage and transport</li>  <li>Aluminum frame is lightweight and strong</li>  <li>Comes with seat belt for added safety</li>  <li>Nylon upholstery is comfortable, lightweight and easy to clean</li>  <li>Weighs only 19 lbs</li>  <li>8-inch composite wheels are lightweight and maintenance free</li>  <li>Comes with swing-away footrests</li>  <li>Padded armrests provide additional comfort</li>  <li>Package includes: Wheelchair, Front Riggings, Owner's Manual</li>  <li>Intended use: Mobility Aid</li>  <li>Brand: Drive Medical</li>  <li>Size: Universal</li>  <li>Materials: Aluminum</li>  <li>Weight capacity: 300 lbs</li>  <li>Dimensions: 33 inches long x 22 inches wide x 39.5 inches high </li> </ul>  <br /> <b><i>Assembly required.</i></b> <br />","We purchased this after observing and studying several others. This transfer chair is now in its third week of use (so I did not rate it for durability, but it looks like it will hold up quite well and is well made and designed). My 80-year-old brother, who cannot walk due to chronic illnesses, likes it very much. It is a lot easier to lift and carry in the car than his regular wheel chair which is too heavy and is too easily damaged by leaning on its side. This chair is light (perhaps 10 pounds), folds and fits easily on the middle seat our our Honda Van, works well and (with his rolle cushion) is quite comfortable. It is a little more difficult to get up over bumps in the sidewalk. It stores well in his room because it folds up easily and the back also folds down so it will fit under his clothes in a closet. The first half of the arms (but not the half-arm rests) fit under restaurant tables. This is important because we use it frequently to take my brother out to lunch. It is not accepted for strapping into a call-a-ride vehicle; for that the user would have to transfer or use a regular wheel chair. It comes pretty much all ready assembled, but without a seat cushion, and all you need is a good sized wrench to adjust the nut on the bottom of the foot rests to the desired length for the user. Overall, we are highly pleased with it."
Drive Medical Fly Lite Ultra Lightweight Transport W  ...,$130.19 - $135.44,4.7/5.0,https://www.walmart.com/ip/Drive-Medical-Fly-Lite-Ultra-Lightweight-Transport-Wheelchair/14563679,"The 19&quot; Fly Lite Ultra Lightweight Aluminum Transport Chair by Drive Medical, available in a variety of attractive colors, is an ultra light transport chair, weighing under 17 lbs without riggings. This transport chair comes with a stylish blue aluminum frame and blue plaid nylon upholstery. It is also durable and easy to clean. Comes standard with a carry pocket on the back rest to easily and securely transport personal items, seatbelt for added safety, and tool free, height adjustable swing away footrests. The deluxe back release allows the back to be folded down easily, making the chair easy to store and transport.","Arrived on time. All was good except right arm rest padding exposed. Walmart notified,  said they would send complaint to Drive Medical. Three wks later have't heard from anyone.  Two days after receiving the traveler, received another of the same. Opened it up and BOTH armrests padding exposed. Reboxed and took to local Walmart and returned it. Although the wheelchair has worked with nominal use, wonder about Drive Medical quality control."
Drive Medical Cruiser III Light Weight Wheelchair wi  ...,$145.43 - $168.08,4.6/5.0,https://www.walmart.com/ip/Drive-Medical-Cruiser-III-Light-Weight-Wheelchair-with-Flip-Back-Removable-Adjustable-Height-Desk-Arms-Swing-away-Footrests/15423521,"The 18&quot; Cruiser III Wheelchair with Flip Back Detachable and Adjustable Height Desk Arms and Swing Away Footrests by Drive Medical has a carbon steel frame that eliminates seat guides and allows for custom back inserts and accessories. The silver vein finish is attractive and easy to maintain. The precision sealed wheel bearing, in front and rear, ensure long lasting performance and reliability, while the 8&quot; front caster wheels provide a smooth ride over most surfaces. The dual axle and removable, flip back, desk arms makes transferring easy. Comes standard with, detachable flip back desk arms, adjustable swing away footrests, black nylon upholstery, composite Mag-style wheels and push to lock wheel locks.","So my father in law was in need of a chair that is wider in the seat (19"") but narrow enough to fit through smaller standard doorways. He is 6'2"" 255 lbs. and the doorways are 29"" wide. The chair has arms that can be pushed right up to the kitchen table for meals too. The arms are not fixed, it would be nice if they were. The legs supports were the only parts not assembled. It was easy to put together. Overall it is a great price and it looks well design with the exception of the arms (they are meant to be removable, the biggest issues is that if you try to grab the chair by the arm and pull the chair, the arm comes free from the lock keeping it in place) . It seats comfortably and rolls nicely. 
Bottom line - for the nasty, cracked chair that Humanna wanted to charge $20/ month x 13 months, this is a better option and it fits my FIL and through the doorways. 
If you go to the manufacture website there is a nice chart with each model chair and their features and measurements. Made it much easier to narrow it down to what model we wanted. Also, it looks like you can purchase replacement parts from the manufacture as well...bonus for that!"
Drive Medical Bariatric Heavy Duty Transport Wheelch  ...,$185.74 - $192.53,4.6/5.0,https://www.walmart.com/ip/Drive-Medical-Bariatric-Heavy-Duty-Transport-Wheelchair-with-Swing-Away-Footrest/15061023,"This Bariatric Steel Transport Chair by Drive Medical has dual, reinforced steel cross braces and a reinforced steel frame for added support can withstand a weight of 450 lbs. The heavy duty, nylon reinforced upholstery comes with a back carry pouch to easily and securely transport personal items. In an attractive blue, this chair comes standard with a roomy, comfortable 22&quot; width seat.","I am a plus sized individual w/multiple sclerosis. I use a walker for short distances and a wheelchair for longer or as needed. This wheelchair is a smooth ride for me, easy on the 'pusher' and though heavy duty, light enough for easy handling, small enough for storage in and out of the vehicle - and looks nice. The price is reasonable also. Great purchase!"
Carex Transport Wheelchair - 19 inch Seat - Folding   ...,$82.82,4.3/5.0,https://www.walmart.com/ip/Carex-Transport-Wheelchair-19-inch-Seat-Folding-Transport-Chair-with-Foot-Rests/33586234,"Transport somebody with mobility issues safely and easily by using this Carex Classics Steel Transport Chair with 19&quot; Seat. It provides safe, sturdy and comfortable portability. Oversized 8&quot; wheels give the Carex transport chair easy maneuverability. The swing-away foot rests and folding feature allow for compact storage and transportation, making it especially well-suited for car trips. It has a weight capacity of 300 lbs and comes with a wide 19&quot; seat for extra comfort and room. No assembly is required, meaning the Carex Classics Steel Transport Chair with 19&quot; Seat is ready to use as soon as it's purchased.","Chair is lite enuf to permit most people to lift to a car trunk.

Without foot rests chair easily passes thru house doors. Seat is wider than the more standard designs.

Excellent chair."
"Drive Medical Sentra EC Heavy Duty Wheelchair, Detac  ...",$237.39 - $347.36,4.6/5.0,https://www.walmart.com/ip/Drive-Medical-Sentra-EC-Heavy-Duty-Wheelchair-Detachable-Desk-Arms-Swing-away-Footrests/15423465,"The Bariatric Sentra EC Heavy Duty Wheelchair with Detachable Desk Arms and Swing Away Footrests by Drive Medical comes with a Dual Cross Bar that reinforces the carbon steel frame, making this chair capable of a 450 lbs. weight capacity. The carbon steel frame has an attractive, chip proof, maintainable, triple coated, chrome finish and double embossed, vinyl upholstery, making this bariatric wheelchair durable, lightweight, attractive and easy to clean. The standard, dual axle, conveniently provides an easy transition of seat to hemi-level. Comes standard with detachable desk arms, swing away footrests, 8 front caster wheels, urethane tires, aluminum footplates, chrome hand rims, and push to lock wheel locks, ensuring user safety. 3 year warranty.","Ordered this wheelchair expecting it to be so-so, but usable, considering the low price. Wow! Was I ever surprised! It is heavy duty and extremely well-made. I would recommend it to anyone that needs one. Also, there was free delivery and no sales tax. Thank you very much.....WalMart is my favorite place to shop!"
Medline Excel K1 Standard Basic Wheel Chair,$131.48,4.1/5.0,https://www.walmart.com/ip/Medline-Excel-K1-Standard-Basic-Wheel-Chair/41133543,"If you or your loved one spends a lot of time using a manual wheelchair, you'll want that wheelchair to be comfortable and reliable. The durable steel Excel K1 Wheelchair by Medline was designed with your comfort in mind. The specially-crafted nylon upholstery is tough and stands up to abuse while it keeps you cool in the summer and warm in the winter. This self-propelled wheelchair also has a roomy seat that measures 18&quot; wide by 16&quot; deep. It's easy to maneuver in and out of the Excel K1 with swing-away legrests. This dual-axle wheelchair is hemi-height adjustable and features smooth-rolling tires that are flat-free. This wheelchair weighs only 35 pounds (without legrests) and is a suitable for users who weigh up to 300 pounds","Excellent value and great performance. This wheel chair exceeded my expectations by comfortably transporting my mother through the Phoenix Zoo Lights for two hours on its maiden voyage. The wheelchair easily maneuvered through crowds, brick, cobblestone, gravel, and paved paths. Best money I've spent for a product. Highly recommend."
"Medline Ultralight Transport Wheelchair with 19"" x 1  ...",$149.99,4.5/5.0,https://www.walmart.com/ip/Medline-Ultralight-Transport-Wheelchair-with-19-x-16-Seat-Red/30458181,"The Medline Ultralight Transport Wheelchair has comfortable nylon upholstery and a back that folds down for easy storage. It's ideal for individuals who still walk by themselves but tire easily. Designed with portability in mind, it is best used for short trips to the store or a day out of the house. The back side features a bottle holder, key ring, cell phone pocket, identification holder and a place for your billfold or iPod. The red Medline transport wheelchair weighs less than 15 lbs so it's easy to get in and out of your vehicle. Rear wheels measuring 8&quot; and a seat belt are built in for extra safety. This wheelchair with seat has restaurant-style permanent armrests that allow the user to pull up to most table heights. It supports up to 300 lbs for sturdiness and reliability.","Very pleased with the Wheelchair construction, lightness for handling, and overall ease of use.  In our situation, the extention of the  foot rests was too short for my wife's long legs and so I returned it with regret because she loved everything else about it.
It's weight of less than 20 lbs made it easy to load into the trunk, or between the seats of our car. 

In processing the ""Return"" paper work, our Walmart contact was most friendly, patient, and helpful in working with me to get the right paper work needed to support the return of our unit."
Drive Medical Cruiser III Light Weight Wheelchair wi  ...,$152.69 - $189.00,4.5/5.0,https://www.walmart.com/ip/Drive-Medical-Cruiser-III-Light-Weight-Wheelchair-with-Flip-Back-Removable-Full-Arms-Swing-away-Footrests/34217340,"The 20&quot; Cruiser III Wheelchair with Flip Back Detachable Full Arms and Swing Away Footrests by Drive Medical has a carbon steel frame that eliminates seat guides and allows for custom back inserts and accessories. The silver vein finish is attractive and easy to maintain. The precision sealed wheel bearing, in front and rear, ensure long lasting performance and reliability, while the 8&quot; front caster wheels provide a smooth ride over most surfaces. The dual axle and removable, flip back, full arms makes transferring easy. Comes standard with, detachable flip back full arms, swing away footrests, black nylon upholstery, composite Mag-style wheels and push to lock wheel locks.","So my father in law was in need of a chair that is wider in the seat (19"") but narrow enough to fit through smaller standard doorways. He is 6'2"" 255 lbs. and the doorways are 29"" wide. The chair has arms that can be pushed right up to the kitchen table for meals too. The arms are not fixed, it would be nice if they were. The legs supports were the only parts not assembled. It was easy to put together. Overall it is a great price and it looks well design with the exception of the arms (they are meant to be removable, the biggest issues is that if you try to grab the chair by the arm and pull the chair, the arm comes free from the lock keeping it in place) . It seats comfortably and rolls nicely. 
Bottom line - for the nasty, cracked chair that Humanna wanted to charge $20/ month x 13 months, this is a better option and it fits my FIL and through the doorways. 
If you go to the manufacture website there is a nice chart with each model chair and their features and measurements. Made it much easier to narrow it down to what model we wanted. Also, it looks like you can purchase replacement parts from the manufacture as well...bonus for that!"
"Drive Medical Sentra EC Heavy Duty Wheelchair, Detac  ...",$251.88 - $283.69,4.6/5.0,https://www.walmart.com/ip/Drive-Medical-Sentra-EC-Heavy-Duty-Wheelchair-Detachable-Desk-Arms-Elevating-Leg-Rests/15423476,"The Bariatric Sentra EC Heavy Duty Wheelchair with Detachable Desk Arms and Elevating Leg rests by Drive Medical comes with a Dual Cross Bar that reinforces the carbon steel frame, making this chair capable of a 450 lbs. weight capacity. The carbon steel frame has an attractive, chip proof, maintainable, triple coated, chrome finish and double embossed, vinyl upholstery, making this bariatric wheelchair durable, lightweight, attractive and easy to clean. The standard, dual axle, conveniently provides an easy transition of seat to hemi-level. Comes standard with detachable desk arms, elevating footrests, 8 front caster wheels, urethane tires, aluminum footplates, chrome hand rims, and push to lock wheel locks, ensuring user safety. 3 year warranty.","Ordered this wheelchair expecting it to be so-so, but usable, considering the low price. Wow! Was I ever surprised! It is heavy duty and extremely well-made. I would recommend it to anyone that needs one. Also, there was free delivery and no sales tax. Thank you very much.....WalMart is my favorite place to shop!"
Drive Medical Super Light Folding Transport Wheelcha  ...,$299.00,4.6/5.0,https://www.walmart.com/ip/Drive-Medical-Super-Light-Folding-Transport-Wheelchair-with-Carry-Bag/15423415,"This Super Light Folding Transport Chair with Carry Bag by Drive Medical has a lightweight, silver aluminum frame and maintenance free composite wheels with rear wheel locks. Weighing only 19 pounds, this transport chair is one of the lightest in the market. It folds like a conventional folding chair and comes with a carry bag for easy storage and transportation. Comes standard with padded flip back arms, composite, maintenance free wheels that provide a smooth ride over most surfaces, fold down footrests and rear wheel locks ensuring a convenient, comfortable and safe transport chair.","I was really worried about traveling to Europe with my mom.  Honesty, I felt that I was gambling when I purchased this chair, but it saved my sanity. It held up on the cobble roads and when I had to lift my mom up curbs.  As a woman, I appreciated that it was lightweight and sturdy (especially on the train). The crossbar foot-rest allowed us to lug our luggage on the chair, while keeping me hands free. We did lose two bolts and nuts, but nothing that stopped us dead.  I've already recommended it to many people."
"Drive Medical Silver Sport 2 Wheelchair, Detachable   ...",$139.60 - $173.01,4.7/5.0,https://www.walmart.com/ip/Drive-Medical-Silver-Sport-2-Wheelchair-Detachable-Desk-Arms-Swing-away-Footrests/15423458,"The 18&quot; Silver Sport 2 Wheelchair with Detachable Desk Arms and Swing Away Footrests comes in an attractive, easy to maintain, powder coated, silver vein finish, and a steel frame for durability. The urethane tires are mounted on composite wheels to provide durability and a smooth ride over most surfaces. The embossed, nylon upholstery is durable, lightweight, attractive and easy to clean. The carry pocket on the backrest provides an easy and safe way to transport personal items. Comes standard with swing away footrests, padded detachable desk arms, push to lock brakes and plastic footplates.","Easy for patient or escort to push and maneuver. The only aspect of the wheelchair not listed in the description is how incredibly easy it is to go from box to rolling out the door. The only 'assembly' required is to adjust the foot rests, which is done without any tools, just using holes and buttons like a cane uses. It would make good marketing/advertising sense to list this piece of informaiton i the product description."
"Drive Medical Chrome Sport Wheelchair, Detachable De  ...",$170.33 - $184.52,4.3/5.0,https://www.walmart.com/ip/Drive-Medical-Chrome-Sport-Wheelchair-Detachable-Desk-Arms-Elevating-Leg-Rests/15423494,"The 20&quot; Chrome Sport Wheelchair with Detachable Desk Arms and Swing Away Elevating Leg rests by Drive Medical comes in an attractive, scratch resistant, durable, low maintenance chrome finish. The embossed vinyl upholstery is durable, lightweight, attractive and easy to clean and the urethane tires are mounted on composite wheels that are low maintenance and provide a smooth ride over most surfaces. Comes standard with, padded detachable desk arms, swing away elevating leg rests, plastic footplates, heel loops, 8&quot; front casters and push to lock brakes ensuring users safety, security and comfort.","Well built, a little heavy if you are totally incapacitated. Legs can be removed if needed. I bought this because my back won't let me stand more than three to five minutes and can only walk roughly 5 to 10 feet before the pain becomes unbearable. My wife has the 24"" wide seat, both work great although the wide one would have some issues moving around in a small home."
Drive Medical Nitro Euro Style Rollator Rolling Walk  ...,$214.79 - $277.47,4.6/5.0,https://www.walmart.com/ip/Drive-Medical-Nitro-Euro-Style-Rollator-Rolling-Walker/22356890,"Drive Medical's Nitro Euro Style Rollator Walker is the ultimate mobility solution that marries advanced reliable features with a sophisticated exterior. The durable frame is made of lightweight aluminum so it's easy to maneuver on any indoor/outdoor terrain, and strong enough to withstand extended daily use. To ensure maximum safety, the brake cable is built into the frame, enhancing the sleek appearance. The Nitro Euro Style Rollator Walker has unrivalled folding capabilities: it easily collapses to an ultra-compact size with one hand by pulling the seat grip up and bringing the ergonomic, height-adjustable handles together so they almost touch. To further offer customized comfort, the removable back is also height-adjustable, and the luxury seat is made of easy-to-clean nylon. Enjoy the complimentary removable zippered storage bag for secure convenience of all your personal belongings whenever travelling with your new Drive Medical Nitro Euro Style Rollator Walker.",My doctor recommended that I use a walker and indicated this walker was one of the best.  I found that I could buy the walker through Walmart for less cost than getting it through my Medicare coverage. This was a big savings to me.
Drive Medical Lightweight Blue Transport Wheelchair,$108.41,4.5/5.0,https://www.walmart.com/ip/Drive-Medical-Lightweight-Blue-Transport-Wheelchair/14563677,"<p>The Drive Medical Lightweight Blue Transport Wheelchair is a useful mobility aid. Weighing in at just 19 lbs, it's easy to maneuver and the composite wheels are maintenance free and flexible. This lightweight wheelchair is made of heavy-duty, non-corrosive aluminum for dependable use and reliable performance. It's ideal for the quick transport of patients to and from treatment sites. You can even use it for inside the home to move a person from one location to another. It includes a seatbelt that lets you secure an ailing or weak patient to the chair and padded armrests for added comfort. It also has swing-away footrests that let you remove a patient from the chair easily and rear handles for sustained comfort and control. This Drive Medical Lightweight Blue Transport Wheelchair features soft yet durable nylon upholstery that's easy to clean as needed. When not in use, simply release the rear hinge, and it folds down for convenient storing and transporting.</p>","This was bought for my 87 year old Mom. She's 5'3 and wears a size 16 pant just to give you an idea of the fit. It fits her well and is comfortable. It's made well and rides smoothly. I like it because it folds up, is light weight and I can get it in the car trunk by myself with no problem. It's made very well and looks nice. Had seen this chair at a specialty store, priced at $ 183 for this exact chair. I would happily buy this chair again!"
"Drive Medical Silver Sport 2 Wheelchair, Detachable   ...",$159.02 - $174.84,0.0/5.0,https://www.walmart.com/ip/Drive-Medical-Silver-Sport-2-Wheelchair-Detachable-Full-Arms-Swing-away-Footrests/40878917,"The 20&quot; Silver Sport 2 Wheelchair with Detachable Full Arms and Swing Away Footrests comes in an attractive, easy to maintain, powder coated, silver vein finish, and a steel frame for durability. The urethane tires are mounted on composite wheels to provide durability and a smooth ride over most surfaces. The embossed, nylon upholstery is durable, lightweight, attractive and easy to clean. The carry pocket on the backrest provides an easy and safe way to transport personal items. Comes standard with swing away footrests, padded detachable Full arms, push to lock brakes and plastic footplates.","It arrived two days after I ordered it....satisfied there,indeed. It is lightweight and manuevers easily because the seat is not as wide as most.My husband (who uses it) is 6foot but very slender, so he fits in it very nicely.(he is around 160lbs ). the foot rests do extend to his size, and his feet position very nicely to the floor when the rests are not on. He says he is comfortable in the chair...but is not in it all the time. stitching and frame seem to be sturdy"
