PerfectDry LUX Automatic Hearing Aid UV-C Disinfecti  ...,$61.49,3.0/5.0,https://www.walmart.com/ip/PerfectDry-LUX-Automatic-Hearing-Aid-UV-C-Disinfecting-and-Cleaning-System-by-Quest/34334951,"The PerfectDry LUX Automatic Hearing Aid disinfecting and cleaning system is an electronic device for the maintenance and storage of many kinds of hearing aids. The maintenance is ensured by the combination of a forced-air fan drying system and UV-C rays for disinfection. This electronic hearing aid cleaner is equipped with a lamp that emits short UV-C rays. Its 360-degree circular disposition enables it to reach all the surfaces of the hearing aids for a deep clean. The UV-C rays destroy 99 percent of viruses and bacteria, which dramatically reduces itchiness and infections of the ear canal for more comfortable wear. This Quest hearing aid disinfectant system has two cleaning options, the fast cycle and the intensive cycle, so you can choose the level of clean that you need."
2 x Small In Ear Hearing Aids Adjustable Tone Invisi  ...,$16.74,0.0/5.0,https://www.walmart.com/ip/2-x-Small-In-Ear-Hearing-Aids-Adjustable-Tone-Invisible-Best-Sound-Amplifier-Aid/986441805,"<h3>Features :</h3> <ul>  <li>100% brand new and high quality</li>  <li>Light Small Sound Amplifier Adjustable Tone ITE Hearing Aid</li>  <li>When you see the film, watch the play, have meeting, or have classes, this product can help you to hear the sound clearly and loudly</li>  <li>Made of durable soft plastic material that comfortable</li>  <li>While in forest, if you want to hear very slight sound, it will be a good choice</li>  <li>It can be used for sound amplifier</li>  <li>Max sound output: 1105dB</li>  <li>Sound gain: 30dB</li>  <li>Total Harmonic Wave Distortion: 10%</li>  <li>Frequency range: 300-4000Hz</li>  <li>Input noise: 40dB</li>  <li>Voltage: DC 1.5V</li>  <li>Current: 4mA</li> </ul> <h3>Important Note :</h3> <ul>  <li>It is forbidden to used by those patients with tympanitis or ear pyogenesis.</li>  <li>Don't use it at high volume for long time. Otherwise it will injure your ear If you feel uncomfortable, please stop using</li>  <li>Please maintain the products all the time, avoid ear plug and sound collecting hole being blocked by foreign objects. It will affect the effect of sound amplifier</li>  <li>Avoid shocking, falling the product. Don't keep or use it in environment of humid or high temperature</li>  <li>Don't throw the scrapped battery as common rubbish, it should be handled by special equipment</li>  <li>Please take out the battery if don't use it for a long time. Otherwise the components will be rotted by time. Rotten liquid from battery</li>  <li>Don't use the product in potential explosive or dangerous environment</li>  <li>Keep the unit away from the children. It will injure him or others, or damage the unit</li>  <li>Powered by AG3 or A312 zinc air battery</li>  <li>Dimensions: app.1.9 x 1.4 x 1.5 cm</li>  <li>Color: As the pictures show</li> </ul> <h3>Package includes :</h3> <ul>  <li>1 x Adjustable Tone Hearing Aid Sound Amplifier</li>  <li>2 x AG3 Button Cell Battery</li>  <li>4 x Earplug</li>  <li>1 x Carrying Case</li>  <li>1 x User Manual</li> </ul> <h3>Note : No retail package to save the cost and protect environment.</h3>"
"Duracell Hearing Aid Batteries with Easy-Fit Tab, Si  ...",$9.8862.0¢/each,4.7/5.0,https://www.walmart.com/ip/Duracell-Hearing-Aid-Batteries-with-Easy-Fit-Tab-Size-312-16-Pack/23810301,"At Duracell, we provide  <b>trusted power</b> to those who depend on us to keep their lives charged. Duracell Hearing Aid Batteries are crafted and infused with triple corrosion protection for battery power you can count on. This 16-pack of high performance hearing aid batteries will last in storage for up to 4 years, so you can rest assured that they will be ready when you need them. Each Duracell Hearing Aid battery tab is extra-long, for ease-of-use and simple installation. Duracell is the #1 trusted battery brand, and is recommended by the Arthritis Foundation for ease of use. We're proud to offer you Duracell 312 Hearing Aid Batteries as part of Duracells trusted lineup of batteries.  <br /> <br />"
(5 Packs) Genuine Phonak Cerustop Wax Traps ...IN TH  ...,$17.38,5.0/5.0,https://www.walmart.com/ip/5-Packs-Genuine-Phonak-Cerustop-Wax-Traps-IN-THE-CERUSTOP-Wrapper/168527126,(5 Packs) Genuine Phonak Cerustop Wax Traps ...IN THE CERUSTOP Wrapper <br /> <ul>  <li>These filters are the Cerustop filters direct from Phonak.</li>  <li>Each pack-8 Filters; 40 filters total.</li>  <li>These are the 3rd generation wax traps.</li>  <li>Direct Phonak replacement for the discontinued Wax Trap 2's</li> </ul>
Hearing Aid Battery Powerone size 13 made in Germany  ...,$15.49,5.0/5.0,https://www.walmart.com/ip/Hearing-Aid-Battery-Powerone-size-13-made-in-Germany-Genuine-60-Batteries/871513407,Hearing Aid Battery Powerone size 13 made in Germany Genuine 60 Pack
"Rayovac Extra Size 312, 60 Hearing Aid Batteries, Ma  ...",$17.90,5.0/5.0,https://www.walmart.com/ip/Rayovac-Extra-Size-312-60-Hearing-Aid-Batteries-Made-in-the-USA-w-Battery-Holder/634595813,"Total of 60 Rayovac Extra Size 312 Hearing Aid Batteries. Made in the USA and Includes Free Rayovac Branded Battery Holder. Guaranteed Fresh with 3-4 Year Shelf Life,"
PowerOne Size 312 Hearing Aid Batteries - 30 count,$9.80,5.0/5.0,https://www.walmart.com/ip/PowerOne-Size-312-Hearing-Aid-Batteries-30-count/191735898,PowerOne Size 312 Hearing Aid Batteries - 30 count <br /> <ul>  <li>Power One Size 312</li>  <li>30 Pack</li>  <li>Does not contain harmful mercury</li> </ul>
Dilwe Mini in Ear Digital Hearing Aid Adjustable Vol  ...,$10.82,0.0/5.0,https://www.walmart.com/ip/Dilwe-Mini-in-Ear-Digital-Hearing-Aid-Adjustable-Volume-Sound-Amplifier-for-the-Elderly-Deaf-Digital-Hearing-Aid-in-Ear-Hearing-Aid/875415480,"Description: <br />This mini hearing aid is specially designed for the hearing losing people which helps them attain clear and smooth sound providing more convenience in daily life. In addition, it also suitable for leisure and entertainment use, such as watch film, TV program, the play, attend meetings or have classes and like that. <br /> <br />Features: <br />High quality material hearing aid sound amplifier is comfortable and safe to wear. <br />Moderate size is just fitable to ears and looks concise and delicate in appearance when using it. <br />Can help you attain clear and smooth sound, which provides you more convenience in daily life. <br />You can increase and decrease the sound by the volume control according to your hearing habit. <br />Wearing it to block the unwanted and noise sounds in the surroundings for offering you a silent and ease environment. <br />Lightweight and discreet enough to fit easily in your pocket or handbag. <br />Suitable for hearing loss people, also can suitable for leisure and entertainment, such as watch film, TV program, the play, attend meetings or have classes and like that. <br /> <br />Specifications: <br />Material: ABS <br />Max Sound Output: 1105dB <br />Sound Gain: ?0dB <br />Harmonic Distortion: F?000HZ?0%, F?000HZ?% <br />Frequency Range: 250-3800 HZ <br />Input Noise: ?0dB <br />Voltage: DC 1.5V <br />Current: ?mA <br />Battery: AG3 Button battery (included) <br />Color: As Pictures Show <br />Size: 2.2 * 1.9 * 1.4cm / 0.9 * 0.7 * 0.6inch <br />Package Weight: Approx. 60g <br />Item Type: Hearing Aid <br />Function: Sound Enhancement, Noise Sound Blocking <br /> <br />Package Include: <br />1 x Hearing Aid <br />3 x Earplug( Different Sizes) <br />2 x Batteries <br />1 x User Manual <br />1 x Package Box <br /> <br />Note: <br />1. On battery cartridge, the sign &quot;+&quot; means positive electrode of battery, while &quot;-&quot; means negative electrode of battery. <br />2. If you can't hear from the hearing aid, please check if the hearing aid is power on, make sure to use the battery in correct direction and if run out of the battery. <br />3. If the sound of hearing aid is very weak and not clear, please check if inside components is loose or the acoustic channel is blocking. <br />4. If you feel uncomfortable, please stop using it. <br />5. Don't use water or organic detergent to clean the hearing aid, don't put it in water. <br />6. Don't throw the waste of the item into fire. <br /> <br /> <br />"
Power One p312 Hearing Aid Battery (10 Packs of 6 Ea  ...,$16.27,4.8/5.0,https://www.walmart.com/ip/Power-One-p312-Hearing-Aid-Battery-10-Packs-of-6-Each/141100463,"Premium hearing aid batteries, designed for today's high tech digital hearing aids. Provides some of the longest lasting batteries. Shelf life 2 1/2 to 3 years from date of purchase. Power One's new generation of hearing aid Batteries are specially designed to operate longer life time in high current drain applications maintaining higher operating voltage and an increased voltage reserve to the 1.1 V cut-off limit of latest digital hearing aid devices."
Hearing Amplifiers Set with New Digital Technology -  ...,$19.99,3.0/5.0,https://www.walmart.com/ip/Hearing-Amplifiers-Set-New-Digital-Technology-Almost-Invisible-Design-Rechargeable-USB-Dock-Personal-Pair-Sound-Amplifier-Adjustable-Volume-Tone-Cont/770893446,"Hear more clearly and crisply with the NewEAR EAR Hearing Sound Amplifier. Each kit comes with a hard storage case, two earbuds and cleaning brushes. There are also extra ear pieces and batteries in the ITC (pair) EAR sound amplifier pack. Designed to look more discreet, each piece has a natural tone and fits inside the ear canal. The volume of each hearing amplifier can be adjusted to a custom level. Sounds will be more defined while background noises and disturbances are filtered out. This medical instrument is designed to be long-lasting and comfortable. Use the pair as a main hearing aid or as a back-up solution. With the convenient storage box, it's easier to keep the devices clean and they can be efficiently transported when traveling. Two different-sized covers are provided so the user can find the best fit. Have a conversation more easily when you try the NewEAR EAR Hearing Sound Amplifier set."
"Phonak Hearing Aid Open Domes, Size Small",$7.99,5.0/5.0,https://www.walmart.com/ip/Phonak-Hearing-Aid-Open-Domes-Size-Small/128714758,"Phonak Hearing Aid Open Domes, Size Small <br /> <ul>  <li>Phonak Hearing Aid Open Domes, Size Small</li> </ul>"
"Duracell Hearing Aid Batteries with Easy-Fit Tab, Si  ...",$14.9763.0¢/each,4.8/5.0,https://www.walmart.com/ip/Duracell-Hearing-Aid-Batteries-with-Easy-Fit-Tab-Size-312-24-Pack/23810302,"At Duracell, we provide  <b>trusted power</b> to those who depend on us to keep their lives charged. Duracell Hearing Aid Batteries are crafted and infused with triple corrosion protection for battery power you can count on. This 24-pack of high performance hearing aid batteries will last in storage for up to 4 years, so you can rest assured that they will be ready when you need them. Each Duracell Hearing Aid battery tab is extra-long, for ease-of-use and simple installation. Duracell is the #1 trusted battery brand, and is recommended by the Arthritis Foundation for ease of use. We're proud to offer you Duracell 312 Hearing Aid Batteries as part of Duracells trusted lineup of batteries.  <br /> <br />"
NanoClean Fine Instrument Hearing Aid Cleaners (20-s  ...,$4.95,0.0/5.0,https://www.walmart.com/ip/NanoClean-Fine-Instrument-Hearing-Aid-Cleaners-20-strand-pkg/102805162,NanoClean Fine Instrument Hearing Aid Cleaners maintain the hygienic condition and performance level of hearing aids and earpieces
Duracell hearing aid batteries size 312 (80 pack),$20.99,4.8/5.0,https://www.walmart.com/ip/Duracell-hearing-aid-batteries-size-312-80-pack/612269656,"*Easier to open packaging that is compact, discreet and totally protects your batteries.*Reliable and long lasting power for your hearing aid.*Pack of 8 of size 312 1.45-Volt zinc air hearing aid batteries (80 total batteries).*Duracell Hearing Aid Batteries EasyTab."
