Vizara Hearing Aid System | Premium Bluetooth Hearin  ...,"$999.00 - $1,899.00",0.0/5.0,https://www.walmart.com/ip/Vizara-Hearing-Aid-System-Premium-Bluetooth-Hearing-Device-with-Recharging-Station-Right-Left-Pair/521796449,Vizara Hearing Aid System by Zounds - Pair (Left &amp; Right)
Alpha 3 Hearing Aid | Smartphone Enabled Premium Hea  ...,$499.00,5.0/5.0,https://www.walmart.com/ip/Alpha-3-Hearing-Aid-Smartphone-Enabled-Premium-Hearing-Device-Patented-Noise-Blocking-System-Right-or-Left/723285115,"<p><strong>ALPHA&nbsp;3&nbsp;Hearing Aid (Left) - BEST IN CLASS VALUE</strong></p>  <p>Each<strong> ALPHA</strong>&nbsp;hearing aid is designed with features to better match each person’s lifestyle. The <strong>ALPHA 3 Hearing Aid&nbsp;</strong>presents a high-quality, low-cost hearing loss solution. Additionally, the&nbsp;<strong>ALPHA 3&nbsp;</strong>hearing aid can connect to&nbsp;<strong>InnerScope’s Smart Control</strong>&nbsp;app (available on iOS &amp; Android), allowing the user to control volume and programs to fit each environment.</p>  <p>Our&nbsp;<strong>Best-Value&nbsp;Hearing Aid</strong> with <strong>Receiver in the Canal Technology</strong>, has all the features you need from a hearing aid, without the exorbitant price tag.</p>  <p><strong>To Sound Natural, Mimic Nature</strong></p>  <p>The <strong>ALPHA 3</strong> takes advantage of a technology platform that mimics your ear. Alpha Series detects sound at different frequencies and levels, then adjusts the sound for your unique hearing loss.</p>  <p><strong>To Improve Understanding in Noise, Direct the Sound</strong></p>  <p>The <strong>Alpha 3</strong> offers several directional technologies to improve hearing in noisy situations. For example, the HIGHLY <strong>Advanced Directional system</strong> creates a focus area in front of the listener — like a listening “beam.” The sounds within the beam are amplified more. The <strong>Alpha 3</strong> varies how much sounds are reduced when they move outside of the beam. Some Alpha Series products have automatic and adaptive directional options that provide hands-free operation in a wide variety of listening environments.</p>  <p><strong>Automatic Options – With Real-Time Data Analysis System</strong></p>  <p>The <strong>Alpha 3</strong> is ready for most listening situations thanks to its Universal listening environment. This feature automatically adjusts the settings of your instrument based on the sounds around you. It instantaneously analyzes factors like ambient noise, the location of noise, and the overall signal-to-speech ratio. You won’t notice it’s making adjustments, but you’ll certainly appreciate the hands-free improvements it brings.</p>  <p>The system works by applying different amounts of amplification based on the loudness of the sound coming into the hearing aid. For soft background sounds that could be annoying, very little-if any-amplification is applied. At sound levels where speech is typically present, maximum amplification is applied. For sounds that are very loud, amplification is reduced to prevent these sounds from becoming uncomfortable.</p>  <p><strong>Reduces Unwanted Background Noise</strong></p>  <p>The <strong>ALPHA 3</strong> incorporates noise reduction systems to make listening more pleasant. After all, you don’t want everything around you to be louder — just the sounds and speech that are most important.</p>  <p>Thanks to its<strong>&nbsp;Instantaneous Noise Blocking System,&nbsp;</strong>which is specifically designed to improve speech understanding in noise, the <strong>ALPHA 3&nbsp;</strong>constantly monitors sounds to separate steady-state background noise from modulated speech. When the system detects that there is more noise than speech, the&nbsp;<strong>Instantaneous Noise Blocking System</strong>&nbsp;automatically engages.&nbsp;</p>"
Energizer EZ Turn & Lock + Power Seal Zinc Air Heari  ...,$10.1864.0¢/each,5.0/5.0,https://www.walmart.com/ip/Energizer-EZ-Turn-Lock-Power-Seal-Zinc-Air-Hearing-Aid-Batteries-1-4V-Mercury-free-Size-312-Pack-of-16/34022365?wpa_bd=&wpa_pg_seller_id=F55CDC31AB754BB68FE0B39041159D63&wpa_ref_id=1f946e250c3263de8a99aa94be971764&wpa_aux_info=__aux_info__&wpa_tag=&wpa_pos=3&wpa_plmt=__plmt__&wpa_aduid=__aduid__,"Energizer EZ Turn &amp; Lock Hearing Aid Battery is Energizer's longest lasting hearing aid battery. These batteries come in an easy-to-handle recyclable packaging keeping your zinc air batteries secure, with longer tabs to make them as simple as possible to handle and insert into your hearing aid. The perforated pack allows easy access in the back of the pack to remove one battery at a time. Energizer Hearing Aid Battery Packs follow the industry standard color-coded system so you can be assured of the correct size every time you buy a battery. This pack contains eight size-10 1.4V zero-mercury and leak-proof zinc air hearing aid batteries.  <br />"
Alpha 5 Hearing Aid | Premium Bluetooth Hearing Aid   ...,$806.45,5.0/5.0,https://www.walmart.com/ip/Alpha-5-Hearing-Aid-Premium-Bluetooth-Hearing-Aid-Device-Patented-Noise-Blocking-System-Right-or-Left/708900558,"<p><strong>ALPHA 5 Hearing Aid (Left)</strong></p>  <p>Each<strong>&nbsp;ALPHA</strong>&nbsp;hearing aid is designed with features to better match each person’s lifestyle. The&nbsp;<strong>ALPHA 5 Hearing Aid&nbsp;</strong>is recommended for someone who enjoys going out to dinner and engaging in social activities with friends or family. Additionally, the&nbsp;<strong>ALPHA 5&nbsp;</strong>hearing aid can connect to&nbsp;<strong>InnerScope’s Smart Control</strong>&nbsp;app (available on iOS &amp; Android), allowing the user to control volume and programs to fit each environment.</p>  <p>Our&nbsp;<strong>ALPHA 5&nbsp;</strong>Hearing Aid&nbsp;with&nbsp;<strong>Receiver in the Canal Technology</strong>, has all the features you need from a hearing aid, without the exorbitant price tag.</p>  <p><strong>To Sound Natural, Mimic Nature</strong></p>  <p>The&nbsp;<strong>ALPHA 5</strong>&nbsp;takes advantage of a technology platform that mimics your ear. Alpha Series detects sound at different frequencies and levels, then adjusts the sound for your unique hearing loss.</p>  <p><strong>To Improve Understanding in Noise, Direct the Sound</strong></p>  <p>The&nbsp;<strong>Alpha 5</strong>&nbsp;offers several directional technologies to improve hearing in noisy situations. For example, the HIGHLY&nbsp;<strong>Advanced Directional system</strong>&nbsp;creates a focus area in front of the listener — like a listening “beam.” The sounds within the beam are amplified more. The&nbsp;<strong>Alpha 5</strong>&nbsp;varies how much sounds are reduced when they move outside of the beam.</p>  <p><strong>Automatic Options – With Real-Time Data Analysis System</strong></p>  <p>The&nbsp;<strong>Alpha 5</strong>&nbsp;is ready for most listening situations thanks to its Universal listening environment. This feature automatically adjusts the settings of your instrument based on the sounds around you. It instantaneously analyzes factors like ambient noise, the location of noise, and the overall signal-to-speech ratio. You won’t notice it’s making adjustments, but you’ll certainly appreciate the hands-free improvements it brings.</p>  <p>The system works by applying different amounts of amplification based on the loudness of the sound coming into the hearing aid. For soft background sounds that could be annoying, very little-if any-amplification is applied. At sound levels where speech is typically present, maximum amplification is applied. For sounds that are very loud, amplification is reduced to prevent these sounds from becoming uncomfortable.</p>  <p><strong>Reduces Unwanted Background Noise</strong></p>  <p>The&nbsp;<strong>ALPHA 5</strong>&nbsp;incorporates noise reduction systems to make listening more pleasant. After all, you don’t want everything around you to be louder — just the sounds and speech that are most important.</p>  <p>Thanks to its<strong>&nbsp;Instantaneous Noise Blocking System,&nbsp;</strong>which is specifically designed to improve speech understanding in noise, the&nbsp;<strong>ALPHA 5&nbsp;</strong>constantly monitors sounds to separate steady-state background noise from modulated speech. When the system detects that there is more noise than speech, the&nbsp;<strong>Instantaneous Noise Blocking System</strong>&nbsp;automatically engages.&nbsp;</p>"
"Energizer Hearing Aid Battery, Zero Mercury Coin Cel  ...",$9.99,5.0/5.0,https://www.walmart.com/ip/Energizer-Hearing-Aid-Battery-Zero-Mercury-Coin-Cell-13-1-4V/112855512?wpa_bd=&wpa_pg_seller_id=F55CDC31AB754BB68FE0B39041159D63&wpa_ref_id=2cedf8a53f56653a604052e26b71354c&wpa_aux_info=__aux_info__&wpa_tag=&wpa_pos=5&wpa_plmt=__plmt__&wpa_aduid=__aduid__,"Energizer EZ Turn &amp; Lock Hearing Aid Battery is Energizer's longest lasting hearing aid battery. These batteries come in an easy-to-handle recyclable packaging keeping your zinc air batteries secure, with longer tabs to make them as simple as possible to handle and insert into your hearing aid. The perforated pack allows easy access in the back of the pack to remove one battery at a time. Energizer Hearing Aid Battery Packs follow the industry standard color-coded system so you can be assured of the correct size every time you buy a battery. This pack contains eight size-10 1.4V zero-mercury and leak-proof zinc air hearing aid batteries.  <br />"
Alpha 9 Hearing Aid | Premium Bluetooth Hearing Aid   ...,"$1,048.39",5.0/5.0,https://www.walmart.com/ip/Alpha-9-Hearing-Aid-Premium-Bluetooth-Hearing-Aid-Device-Patented-Noise-Blocking-System-Right-or-Left-Year-Supply-of-Batteries-Included/986943329,"<p><span style=""font-size: 18pt;""><strong>ALPHA 9 Hearing Aid (Left) - BEST IN CLASS</strong></span></p>  <p><span style=""font-size: 18pt;"">Each <strong>ALPHA</strong> hearing aid model is designed with different features to better match each person’s lifestyle. The <strong>ALPHA 9 </strong>is the pinnacle of the <strong>ALPHA</strong> line. On the strength of its&nbsp;<strong>Premium Surround Sound Processor</strong>, it is recommended for those with an active lifestyle who regularly engage in social interactions and different environments.</span></p>  <p><span style=""font-size: 18pt;"">The<strong> ALPHA 9's DFS System&nbsp;</strong>suppresses feedback while still allowing sufficient gain without compromising sound quality. Additionally, the&nbsp;<strong>ACOUS-TAP&nbsp;</strong>button allows for added user versality and comfort. With a simple touch of a button, the user can toggle between multiple enviornmental settings.</span></p>  <p><span style=""font-size: 18pt;""><em>Connect to your smartphone with ease!</em>&nbsp;<strong>ALPHA</strong> hearing aids can connect to <strong>InnerScope’s Smart Control</strong> app (available on iOS &amp; Android), allowing the user to control volume and programs to fit each environment.&nbsp;</span></p>  <p>&nbsp;</p>  <p>&nbsp;</p>"
Prezia Hearing Aid System by Zounds - Receiver in th  ...,"$799.00 - $1,599.00",0.0/5.0,https://www.walmart.com/ip/Prezia-Hearing-Aid-System-by-Zounds-Receiver-in-the-Canal-Hearing-Aid-Device-Environmental-Noise-Reduction-Pair/408301034,Prezia Hearing Aid System by Zounds - Pair (Left &amp; Right)
HB100 | Digital Hearing Aid Kit | Receiver-in-Canal   ...,$399.00 - $798.00,0.0/5.0,https://www.walmart.com/ip/HB100-Digital-Hearing-Aid-Kit-Receiver-in-Canal-Technology-Four-Program-Presets-by-Zounds-Hearing-Inc/399928890,HB100 Hearing Aid Kit - Pair (Left &amp; Right)
LifeEar Core Hearing Aid | Customizable Bluetooth He  ...,"$725.81 - $1,451.61",0.0/5.0,https://www.walmart.com/ip/LifeEar-Core-Hearing-Aid-Customizable-Bluetooth-Hearing-Aid-Device-Right-Left-Ear-or-Pair/522104300,"<h4>The LifeEar&nbsp;<em>CORE</em></h4>  <h4>LifeEar&reg; CORE puts you in control, helping you optimize your hearing without the appointments at the local hearing clinic. LifeEar hearing aid changes and adapts to your hearing. Advanced digital sound technology creates accurate, unique personal profiles in the privacy of your own home, instantly personalizing your hearing aids so conversations and sounds stay crisp, sharp, and clear — year after year.</h4>"
Simplicity Smart Touch Hearing Aid Pair,$383.28 - $899.00,4.2/5.0,https://www.walmart.com/ip/Simplicity-Smart-Touch-Hearing-Aid-Pair/19511763,"The Simplicity Smart Touch Hearing Aid Pair will allow you to start enjoying the pleasure of everyday sounds again quickly and easily. The small size of these devices makes them lightweight, so they can be comfortably worn all day long. Additionally, they do not interfere with eyeglasses. These Simplicity hearing aids feature an open-fit design in the soft sound dome, leaving the ear canal unblocked and allowing natural sounds to pass through without being amplified. The highly desirable design will eliminate any tunnel or echo sensation. These hearing devices also feature advanced active feedback management to help reduce annoying feedback or whistling noise that is a common side-effect with hearing aids. The nearly invisible micro poly-tubes offer comfort and flexibility for extended wear time."
"Simply Soft Smart Touch Hearing Aid, Pair",$416.74 - $849.00,3.2/5.0,https://www.walmart.com/ip/Simply-Soft-Smart-Touch-Hearing-Aid-Pair/19511766,"The Simply Soft Smart Touch Hearing Aids are audiologist-recommended to help you hear everyday sounds more easily. They are designed for those with mild-to-moderate flat hearing loss and individuals that have a high-frequency (treble) hearing loss but also need assistance in the lower frequencies (bass). They utilize advanced technology that offers clean amplification for a wide variety of situations you may encounter. That technology incorporates sophisticated 100 percent digital processing to optimize sound clarity in a wide range of listening situations. These Simply Soft hearing aids fit discreetly and comfortably in the ears for both men and women. The ultra-soft body provides a comfortable, secure fit and accentuates the superior sound quality. These hearing devices slip into your ears, creating an acoustical seal that helps to eliminate annoying feedback."
Simplicity Smart Touch Digital Over-the-Ear Hearing   ...,$383.28 - $459.89,4.2/5.0,https://www.walmart.com/ip/Simplicity-Smart-Touch-Digital-Over-the-Ear-Hearing-Aid-Left-Ear/15599962,"This Simplicity Smart Touch Digital Over-the-Ear Hearing Aid helps individuals who are hard of hearing continue to function normally. Auditory loss is a personal and costly condition. Oftentimes, the person with the hearing loss is the last to acknowledge their struggles. General Hearing Instruments (GHI) has a solution to help consumers with a mild to moderate high-frequency loss. GHI leads the market with an affordable line of 100 percent digital and analog hearing aids in both In the Ear (ITE) and Over the Ear (OTE) styles. Their hearing aids are so discreet and lightweight you will forget you are wearing them. GHI manufactures these them to the exact same specifications as the custom models they offer to audiologists. The Simplicity hearing aid allows you to clearly hear the everyday sounds you used to take for granted, such as children, birds chirping, people talking and more."
Simplicity Smart Touch Digital Over-the-Ear Hearing   ...,$488.81 - $499.00,4.2/5.0,https://www.walmart.com/ip/Simplicity-Smart-Touch-Digital-Over-the-Ear-Hearing-Aid-Right-Ear/15599961,"This Simplicity Smart Touch Digital Over-the-Ear Hearing Aid is discreet and lightweight so you will practically not even know that you are wearing it. Auditory loss is a difficult condition, and the individual affected is oftentimes the last to acknowledge their struggles. This Simplicity hearing aid is designed to the exact specification as the custom hearing aids offered to audiologists. With it, you can restore confidence and the ability to interact in conversations with family and friends again. This right ear hearing aid has advanced digital technology that provides natural sound throughout the entire hearing spectrum. It has active feedback manager programming that reduces annoying feedback or whistling common in most hearing aids. It has easy-to-use push button control that allows you to scroll through four amplification settings. The open ear design leaves ears unblocked, and the sound seems more natural without a plugged up feeling."
"SimplySoft Classic Hearing Aid Left, Ear",$399.00,3.7/5.0,https://www.walmart.com/ip/SimplySoft-Classic-Hearing-Aid-Left-Ear/19511760,"<p>The SimplySoft Classic Hearing Aid has a multi-patented design that represents the perfect combination of quality sound amplification and ultra-soft comfort. It fits comfortably and conveniently in your ear canal, creating an acoustical seal to help eliminate irritating feedback. It is also discreet and almost invisible and even flexes with the ear rather than being disrupted by jaw movement. Therefore, you won't have to adjust it after talking or chewing. The patented SoftEar body of this left ear hearing aid offers relaxed hearing flexibility and comfort for extended wear. This SimplySoft Classic Hearing Aid features manual volume control for a more precise sound amplification. It is made of 100 percent hypoallergenic medical grade silicone for sensitive ears. </p>"
"SimplySoft Classic Hearing Aid, Right Ear",$399.00,3.7/5.0,https://www.walmart.com/ip/SimplySoft-Classic-Hearing-Aid-Right-Ear/19511764,"<p>The Simply Soft Classic Hearing Aid is a multi-patented design that represents the ideal combination of quality sound amplification and ultra-soft comfort. The efficient circuitry will optimize the clarity of sound in a wide range of listening situations with an extremely long battery life. This hearing aid offers manual volume control for maximum precision. It is designed for those with a mild-to-moderate flat hearing loss, and individuals that have a high-frequency (treble) hearing loss, but also need assistance in the lower frequencies (bass).The patented soft silicone material offers comfort and flexibility. It slips into most ear canals for a nearly invisible fit. This small right ear hearing aid forms a unique acoustical seal to help eliminate annoying or irritating feedback. The SimplySoft Classic is designed to fit your unique ear shape.</p>"
Ovation Elect Digital Hearing Aid,$179.99,0.0/5.0,https://www.walmart.com/ip/Ovation-Elect-Digital-Hearing-Aid/195368398,"The Ovation Elect is the next-generation hearing solution that is specifically designed to turn up the volume on your hearing, but at a fraction of the price of a traditional hearing aid. Combining the same core technology as much higher priced devices with our exclusive universal pre-programmed settings, the Ovation Excel can help you enjoy all the sounds you've been missing. The Excel features a nearly-invisible mini-BTE design and comes equipped with 4 unique listening programs and an on-device volume control. <br /> <br />Each device comes with: <br /> <br />3 closed tips // 3 open tips // 24 batteries // 2 tubes // 1 cleaning brush // 1 cleaning wire // 1 storage case // 1 user guide"
Ovation Excel Digital Hearing Aid,$299.00,0.0/5.0,https://www.walmart.com/ip/Ovation-Excel-Digital-Hearing-Aid/852286295,"The Ovation Excel is the next-generation hearing solution that is specifically designed to turn up the volume on your hearing, but at a fraction of the price of a traditional hearing aid. Combining the same core technology as much higher priced devices with our exclusive universal pre-programmed settings, the Ovation Excel can help you enjoy all the sounds you've been missing. The Excel features a nearly-invisible mini-BTE design and comes equipped with 4 unique listening programs and an on-device volume control. <br /> <br />Each device comes with: <br /> <br />3 closed tips // 3 open tips // 24 batteries // 2 tubes // 1 cleaning brush // 1 cleaning wire // 1 storage case // 1 user guide"
Ovation Boost Digital Hearing Aid,$399.00,0.0/5.0,https://www.walmart.com/ip/Ovation-Boost-Digital-Hearing-Aid/896806904,"The Ovation Boost is our most popular model and gives you the greatest amount of control over your hearing. Whether you choose a pre-programmed model or want the device to be programmed to your audiogram results, the Ovation Boost will come equipped with 4 unique listening programs, and an on-device volume control. Simply put, the Ovation Boost will give you the freedom to hear what you want, when you want in nearly any setting. <br /> <br />Each device comes with: <br /> <br />3 closed tips // 3 open tips // 24 batteries // 2 tubes // 1 cleaning brush // 1 cleaning wire // 1 storage case // 1 user guide"
Ovation Standard Digital Hearing Aid,$299.00,0.0/5.0,https://www.walmart.com/ip/Ovation-Standard-Digital-Hearing-Aid/560434991,"While small in size, the Ovation Standard is packed with some of the most advanced digital technology available today. This device offers maximum concealment by sitting gently in your ear canal and comes with multiple sizes of ear tips to ensure a proper fit. <br /> <br />Each device comes with: <br /> <br />dome tips // 24 batteries // 1 cleaning brush // 1 storage case // 1 user guide"
Ovation Lift Digital Hearing Aid,$599.00,0.0/5.0,https://www.walmart.com/ip/Ovation-Lift-Digital-Hearing-Aid/875376051,"The Ovation Lift is the smallest of the Ovation Hearing Aids, but also contains all of the best features, providing you with top-of-the-line performance and usability. With its open-fit design, the Ovation Lift rests gently and comfortably in your ear and is nearly invisible when in use. <br /> <br />Each device comes with: <br /> <br />1 retention loop // 1 protective sleeve // wax guard set // 24 batteries // 1 storage case // 1 user guide"
Audicus Dia II Hearing Aid - Pair,"$1,278.00",0.0/5.0,https://www.walmart.com/ip/Audicus-Dia-II-Hearing-Aid-Pair/463636009,"The Audicus Dia II is a highly versatile Behind the Ear (BTE) digital hearing aid for all your hearing needs. Its award-winning, discreet hearing aid design, combined with its ability to accommodate up to severe hearing loss, makes it an option for nearly anyone looking for a behind the ear hearing aid. With two directional microphones, eight channels, and advanced signal processing, the Dia II BTE hearing aid is equipped to drown out background noise and amplify speech. It features auto-adapt technology to work in a host of listening environments, as well as multiple volume settings for maximum control. This is the top discreet hearing aid on the market today. Customization &amp; free testing included with purchase."
Eva - The First Hearing Aid Designed for Women,$499.00 - $998.00,0.0/5.0,https://www.walmart.com/ip/Eva-The-First-Hearing-Aid-Designed-for-Women/231193422,Eva - Hearing Aid Designed for Women is the first hearing aid designed specifically for women's hearing loss patterns. Eva hearing aids provide a low-profile design for invisible secure fit and maintaining an active lifestyle. Eva hearing devices can be programmed specifically for your hearing loss. Eva is 100% digital and can deliver excellent sound quality that is as clear as hearing aids sold for thousands of dollars.
iHEARmax™,$499.00 - $998.00,0.0/5.0,https://www.walmart.com/ip/iHEARmax/221410921,"iHEARmax Hearing Aid with the standard wire size is a virtually invisible behind-the-ear hearing aid for adults 5'3&quot; and taller. iHEARmax Hearing Aids are powerful, miniature devices for treatment of mild to severe hearing loss, recommended for all ages (18+). iHEAR hearing devices can be programmed specifically for one's individual hearing loss. iHEARmax is 100% digital and can deliver excellent sound quality that is as clear as hearing aids sold for thousands of dollars. Programming is not required but custom home programming is available with purchase of the iHEARmax Hearing Aid Programming Kit."
Rechargeable Invisible Mini Hearing Aid Ear Sound Am  ...,$26.48,0.0/5.0,https://www.walmart.com/ip/Rechargeable-Invisible-Mini-Hearing-Aid-Ear-Sound-Amplifier-Hearing-Aids-Adjustable-Volume-Tone-with-4-Ear-Plugs-For-Left-Right-Ears-FDA-Approved/285601122,"<ul>  <li>K-88 is a mini size rechargeable hearing aid with lightweight and can be used in either ear,inside built in high capacity NI-MH battery, it only take 3~4hours to charge,and it can work for about 30hours after fully charge.</li>  <li>package included</li>  <li>1 x Hearing aid</li>  <li>4 x Ear plugs(Different size)</li>  <li>1 x String</li>  <li>1 x Box</li>  <li>1 x Charger(US plug</li>  <li>1 x User manual</li>  <li>Features </li>  <li> 1. Lightweight personal sound amplifier maximizes the natural ability to hear sounds</li>  <li> 2. Designed to fit either ear</li>  <li> 3. Product comes with rechargeable function, no need to replace the batteries.</li>  <li> 4.Loudly &amp; Clearly </li>  <li>Description </li>  <li>1.Model:K-88 </li>  <li>2.Max Sound Output:1105dB</li>  <li>3.Max Sound Gain:30 dB</li>  <li>4.Harmonic Wave Distortion:10%</li>  <li>5.Frequency Range:300~4000 Hz</li>  <li>6.Input Noise:40 dB</li>  <li>7.Battery:NI-MH battery</li>  <li>8.Working VoltageDC 1.5V</li>  <li>9.Working Current:4mA</li>  <li>10.Measurement:22*19*15mm</li>  <li>Note:</li>  <li>Dear customer, please read the instructions carefully before using.</li>  <li>We will region according to the customer, select the appropriate charger, you can also give us a message</li> </ul>"
