Mabis Healthcare Foot Stool with Handle,$39.98,4.7/5.0,https://www.walmart.com/ip/Mabis-Healthcare-Foot-Stool-with-Handle/10161108,"Safety While You Step <br />When you need to reach something on the top shelf or step up to a higher level such as a bed or vehicle, the DMI Step Stool gives you the height and stability you need. Unlike most step stools that provide no place to put your hands, the DMI step stool gives you a convenient handle to use to steady yourself. No more losing your balance as you climb to a higher level! You will also gain firm footing on the non-slip matting. <br /> <br />Get Into Vehicles With Ease <br />Do you or one of your family members need a boost when getting into higher profile vehicles like vans, trucks and SUVs? This sturdy stool will make it easier than ever to take that extra step. No more worries about elderly relatives or children getting into your car!"
Costway 10' ft Aluminum Folding Wheelchair Scooter M  ...,$239.99,5.0/5.0,https://www.walmart.com/ip/Costway-10-ft-Aluminum-Folding-Wheelchair-Scooter-Mobility-Ramp-Portable-Non-Slip/172437211,"Make it easier for the elderly and the people with limited mobility to move around with this Costway 10' Aluminum Folding Wheelchair Scooter Ramp. This accessory is useful for loading onto porches, curbs, landing steps or mini vans. The ramp itself can accommodate up to 600 lbs of weight. It has a 2.5&quot; angled lip with holes to make sure they stay in place. The serrated top is purposely applied to prevent slipping. This wheelchair ramp's non-slip surface makes it safer for people on wheelchairs to go up or down. It offers a 35&quot; maximum rise for occupied chair or scooter passage. The folding design of this portable wheelchair ramp for vans makes it convenient for storage and portability."
Uplift Premium Power Seat Assist - Chair Lift And So  ...,$169.90,3.9/5.0,https://www.walmart.com/ip/Uplift-Premium-Power-Seat-Assist-Chair-Lift-And-Sofa-Stand-Assist-17/21453288,"This Uplift Premium Power Seat Assist can help individuals go from a seated position to standing gently and efficiently. The width of the base measures 17&quot; and can be used on most armchairs or sofas. A power lifting seat, it can plug into a wall socket and is ideal for handicapped or elderly individuals. Even more comfort comes from the memory foam core of the cushion that molds to your body. This Uplift seat can be used by individuals who weigh up to 300 lbs. The lightweight, portable style makes it easy to use around the house or take when on the go. A washable cover is made of comfortable and breathable mesh fabric for added airflow. Activate with an easy to use hand-held controller and the Uplift Premium Power Seat Assist helps take the strain out of standing and makes it easier on the knees and back."
Mattress Wedge,$18.71 - $37.42,5.0/5.0,https://www.walmart.com/ip/Mattress-Wedge/48842221,"The Mattress Wedge closes the gap between the mattress and the headboard or wall, allowing pillows to stay comfortably under your head. The triangular design is made of sturdy and lightweight foam and can prevent remotes, books and toys from falling through. It stays cool in the summer and insulates during the winter, ensuring comfort all year. This headboard pillow wedge comes with a 100 percent pure cotton, washable cover and includes convenient removable side storage pockets. It unrolls in seconds and fits king, full and twin size mattresses. The wedge is versatile enough to work lengthwise, closing the gap between split mattresses or the side of a bed against the wall."
Able Life Universal Stand Assist,$79.00,4.7/5.0,https://www.walmart.com/ip/Able-Life-Universal-Stand-Assist/39992212,"The Universal Stand Assist by Able Life offers a simple way to stand from any couch, chair, or recliner with greater ease and strength. It will fit under or on top of cushions and provides a handle to use to safely rise from or lower to any seated position safely. Adjusts in height, depth, and width to fit a wide range of couches and chairs (H 22&quot; - 32&quot;, D 23&quot; - 26&quot;, W 19&quot; - 26&quot;). Supports 300 lbs."
DMI Donut Seat Cushion Pillow for Tailbone Pain and   ...,$17.89,3.6/5.0,https://www.walmart.com/ip/DMI-Donut-Seat-Cushion-Pillow-Tailbone-Pain-Hemmorhoids-18-inch-Pregnancy-Donut-Sitting-Pillow-Therapeutic-Molded-Foam-Ring-Donut-Pillow-Navy/22440458,DMI FM INVLD CSHN WRP
Premium Memory Foam Seat Cushion Pain Relief for Coc  ...,$18.99,5.0/5.0,https://www.walmart.com/ip/Premium-Memory-Foam-Seat-Cushion-Pain-Relief-Coccyx-Tailbone-Hemorrhoids-Sciatica-Sacrum-Perfect-Fit-Wheelchair-Cushion-Pad-Pillow-Handle-Orange/784827415,"Looking for a  <b>comfortable</b> place to sit everywhere you go? Look no further than the new  <b>Techege Comfortable Seat Cushion</b>! We were tired of pricy portable seats that didn't really provide us with that much  <b>comfort</b> so we set out on a mission and this  <b>comfortable cushion</b> is the result!  <br />  <br /> We did the hard part and tracked down the manufacturer of one of the most comfortable orthopedic cushions we could find, and now we are offering it to the public at a price that will be hard to  <b>beat</b>!  <br />  <br />Whether you are looking for a place to sit on a train, a plane, in a car, truck, van or SUV, a wheelchair, stadium seat, park bench or even the ground, the  <b>Techege Comfortable Seat Cushion</b> will have your back! Made from memory foam and about the size of your butt, you can squish it into a bag and take it with you and pull it out when you need it. Watch it bounce back to life and be ready for relieving your stress in seconds!"
Drive Medical Side Style Hemi One Arm Walker,$38.06,4.7/5.0,https://www.walmart.com/ip/Drive-Medical-Side-Style-Hemi-One-Arm-Walker/15423449,The Side Style Hemi Walker by Drive Medical is designed for individuals with the use of only one hand or arm. It is also ideal for individuals who do not require a walker but need a wider base for support. This product is lighter than a walker and more stable than a cane ensuring user safety.
Carex Walker Ski Glide,$6.48,4.5/5.0,https://www.walmart.com/ip/Carex-Walker-Ski-Glide/10318499,"Improve your mobility with these Carex Walker Ski Glides. Specially made to attach to the rear legs of a front-wheeled walker, they move smoothly over different types of surfaces. They feature a slim size that makes them simple to install. Made of durable white plastic, they slide easily over grass, cement and carpet. These non-slip rolling walker glides will even fit most walkers. They're finished in white and feature a lightweight construction for stress-free use. They can even be stored in a bag or purse until you need them."
